company,ticker,title,body,date,replies
Deluxe Corp.,DLX,"deluxe is hosed, noting more to say","deluxe is hosed, noting more to say. i mean who are we kidding guys deluxe dont have future. marketing will be the first to go...",2009-06-28,0
Demand Media Inc.,DMD,StudioD Team Layoffs 2017,Do you have updates on what's going on here?,2017-03-10,0
Demand Media Inc.,DMD,Any updates on 2016 layoffs in Los Angeles?,"I hear rumors about job cuts at DM, I left last year. Good luck.",2016-02-15,1
Demandware Inc.,DWRE,You should stop dealing with Fluid since they are dropping ecommerce.,no body text,2015-12-15,0
Denbury Resources Inc.,DNR,PV merger,"i can't believe the merger isn't going to happen. denbury shareholders are stupid. PR oversold the EOR thing and has now crippled us so that we can't diversify. CK will have to explain to them why it's good to NOT have your eggs all in one basket...
read more",2019-03-22,1
Denbury Resources Inc.,DNR,spe this week,bet CK puts on a great show!!,2019-03-18,3
Denbury Resources Inc.,DNR,raises coming?,Mr. Kendal said raises on april 1 In that email the other day. We haven’t heard a thing out here and nobody seems to know or keen on telling us . Nothing was told on the town meeting video either last week. any word at the plano office?,2019-03-05,5
Denbury Resources Inc.,DNR,thoughts on Thurs. meeting?,will there be talk of annual bonus? will it be enough to make up for loss of LTI?,2019-02-26,7
Denbury Resources Inc.,DNR,Cafe status,i've been gone a while...what's the status of the cafe? they still serving food? is it still free or reduced price?,2019-02-18,4
Denbury Resources Inc.,DNR,All I can say is I wish the current CEO had been there when I was,"All I can say is I wish the current CEO had been there when I was. At least he's got some sort of plan and idea for growth. PR was a financial engineer. Had no clue how to run a company and actually grow the thing. He convinced the board to runoff...
read more",2019-02-14,0
Denbury Resources Inc.,DNR,Why hang on to a sinking ship?,"Just curious as to what is keeping you at DNR? It is no longer what it once was, and with so many other good companies out there.. why do this to yourself?",2019-02-09,8
Denbury Resources Inc.,DNR,Bright side,"It can only go up from here, right?",2019-02-07,7
Denbury Resources Inc.,DNR,I bet we....,Cut some more folks. With lower prices and this acquisition...i bet we carve a few off.,2019-01-09,4
Denbury Resources Inc.,DNR,Raises and bonus,"So what’s the word on the street about raises and bonus. Seems like no communication about raises or even timing of them. Also no transparency of where we are trending with the bonus. Can’t imagine it’s anywhere close to the target we were told early...
read more",2018-11-30,7
Denbury Resources Inc.,DNR,Penn Virginia,"Wall Street does not favor this acquisition, what does everyone else think?",2018-10-30,4
Denbury Resources Inc.,DNR,Are you happy with the promotion cycle?,no body text,2018-10-25,10
Denbury Resources Inc.,DNR,Operations Reorganization,What is the plan? Hearing widespread changes coming to all Ops. Just rumors? Many good employees have left in the last few months. Anyone concerned or surprised? Stock is up so no one is worried?,2018-10-10,2
Denbury Resources Inc.,DNR,What's the latest rumor on the sale?,It was some visitors in the field...wonder if those was prospects or just lookers.,2018-05-30,5
Denbury Resources Inc.,DNR,town hall meetings,i wonder if they've had time to incorporate any of the survey responses into the remarks for the town hall meetings,2018-05-14,3
Denbury Resources Inc.,DNR,Survey,Is this to be considered for a best place to work or just a check in? Serious question here.,2018-04-26,6
Denbury Resources Inc.,DNR,COBRA Insurance,"Any idea how much it cost, how long it lasts and what is included?",2018-03-21,2
Denbury Resources Inc.,DNR,Wow @ the response,"So we announce we're selling our core properties that this company was built on on this place is silent Let em move the yogurt machine in plano and this place lights up like Facebook. A lot of people look at this for water cooler talk but I guess it...
read more",2018-02-23,22
Denbury Resources Inc.,DNR,Best decision ever!,"I left before the 3rd layoffs. Best decision ever! Found better pay, and I didn't have to suffer from depression at walking past all of the empty offices. It was such a great place to be in the 6 years I worked there, but its time for people to go if...
read more",2018-02-20,0
Denbury Resources Inc.,DNR,The LTI needed to be reworked.,"It really was an incredible asset for all the employees but it was just unsustainable at that level for an industry where everyone is cutting costs and most companies didn't offer to everyone. With base salaries finally showing upward movement and...
read more",2018-02-20,3
Denbury Resources Inc.,DNR,"What’s the word on street for LTI/Bonus? Anyone got updated numbers? Bad, good, no change?",no body text,2018-02-14,28
Denbury Resources Inc.,DNR,Blueberries in the cafe?,I’m sad that wasn’t discussed today. I think we should at least consider bringing them back.,2018-02-07,5
Denbury Resources Inc.,DNR,"Bye Bye Love, Bye Bye LTI!!","Finally they are pulling the plug on the LTIs for all the ""non"" technical staff. We engineers/geologists are doing all the work and floating the boat while the others just sit all day and keep milking the cow! DNR is not a charity, although some of...
read more",2018-02-06,41
Denbury Resources Inc.,DNR,Saddest most depressing demotivating environment on earth,"Like what I do, family is good but every day I come in and work in the saddest most depressing place. I'm so tired of hearing about all the bad, being picked over and beat down every day because of how we park, where we eat, how much paper we print...
read more",2018-01-30,10
Denbury Resources Inc.,DNR,Frying Pan to Fire,How many do we think put in their notices today since we got our bonus? Be careful not to jump from the frying pan directly into the fire. Grass is ALWAYS greener on the other side.,2018-01-11,12
Denbury Resources Inc.,DNR,90% bonus?! No way. Last ditch effort to keep us? We're gone...,"Dumbest thing ever. We can't have lunch, our insurance is horrible, can't use our good vendors so I'm using the cheap unsafe ones, many of us will have our pay cut, stock is being dumped soon...but the idiot next to me who does nothing but read this...
read more",2017-12-15,37
Denbury Resources Inc.,DNR,Denbury office move closer to downtown Dallas,I heard from a realtor friend that DNR is looking for new office space closer to downtown Dallas. Contract starting date is 06/2018..... every day another surprise at DNR,2017-12-06,22
Denbury Resources Inc.,DNR,Note exchange agreements,What does the announcement that Denbury has entered into note exchange agreements mean for Denbury employees?,2017-12-04,5
Denbury Resources Inc.,DNR,Laid off employee,"I was laid off the third round of cuts, it turned out to be a blessing. I’ve landed a job more than doubling my monthly income with Denbury. I have a lot of friends that are still with Denbury and I wish them all the best!",2017-12-01,5
Denbury Resources Inc.,DNR,The 2 types of narcissists you’ll meet at work - Sound familiar anybody?,http://t.ted.com/82Br0hB,2017-11-11,0
Denbury Resources Inc.,DNR,Have my second interview at Pioneer,Too many in HR with the CPA talking about us making too much. We can't afford to lose even more pay than we already have with our stock and bonus cuts. Pioneer is the same Drive for me and they're not slashing their people or cutting their pay.,2017-10-24,8
Denbury Resources Inc.,DNR,Morale is low at Denbury,"I am busting my a-- as well, but I also am getting frustrated. I talk to my peers at other O&G companies in DFW and Houston and, while everyone is dealing with the new reality of $50 oil, there doesn't seem to be the demoralizing environment that we...
read more",2017-10-23,3
Denbury Resources Inc.,DNR,"""Job Elimination"" the new Layoff by our CPA HR","Just watched 2 well paid good older workers get walked out today. Their jobs were eliminated. We just hired someone last month (young and cheap). Twice now. No more big layoffs, just small ones you never see coming. HR made sure management couldn't...
read more",2017-10-16,23
Denbury Resources Inc.,DNR,I will quit Monday. You heard it here first!,no body text,2017-10-13,15
Denbury Resources Inc.,DNR,Out the door!,Sounds like quite a few engineers are making a run for it. Looks like it's time to split before your workload doubles...,2017-10-10,5
Denbury Resources Inc.,DNR,Mass exodus?,"But oil is at $50.. there are no jobs out there! Surely, no company is profitable in this environment; you should be thankful to have a job.... blah blah blah.. At least that is what they have been feeding us. This is what happens when you keep...
read more",2017-10-06,1
Denbury Resources Inc.,DNR,Unemployment Benefits 8/10 RIF,"If you were impacted by the last RIF, please comment and advise whether or not TWC has approved your unemployment benefits. Myself and several others have been denied until our severance weeks end while others are receiving payment. This is...
read more",2017-10-03,3
Denbury Resources Inc.,DNR,***Questions for the townhall meeting***,Ask truly anonymous questions for the townhall meeting here! Go wild!,2017-10-03,6
Denbury Resources Inc.,DNR,"On a scale of 1 – 10 with 10 being the most positive, how would you rate the job CK is doing?",no body text,2017-10-03,2
Denbury Resources Inc.,DNR,Who else has doubts?,"After the promotion announcement and more I really doubt the cost savings lines. We laid off only to promote and I'm sure give raises to new VIce Pres? I'm sure the majority of us will go on to year 3 with no raise and less bonus and benefits. I was...
read more",2017-09-27,22
Dendreon Corp.,DNDN,New Layoffs and Old (New Jersey manufacturing facility),"We had to cut 600 jobs and closed our New Jersey manufacturing facility back in July of last year - target savings were 100 mil plus... Earlier this month we had cut another 150 jobs, probably to save another 50 mil or so...",2013-11-27,0
Dendreon Corp.,DNDN,layoffs immanent,"Provenge is not selling well, sales numbers are dropping, we'll be cutting around 100 people and hope to save up to 100 mil or so",2013-11-13,0
Denny's Corp.,DENN,List of Denny's Restaurants Closing in 2015,"Do you maybe have a list with restaurants that will be closing in 2015? I am specifically interested in stores closing in California, Arizona, Nevada, Utah, Oregon and Washington. I heard that 888 S FIGUEROA ST, 635 S. VERMONT AVE., 400 N VERMONT...
read more",2015-02-03,1
Denny's Corp.,DENN,Downsizing in the West,Do you know if we'll be closing restaurants in the West. I heard rumors that up to 10 restaurants might be closed within next three months. It's not like Denny's is super popular today and I can see something like this happening.,2014-02-25,1
Denny's Corp.,DENN,denny's getting ready to lay off people in las vegas,denny's getting ready to lay off people in las vegas,2013-10-23,0
Denny's Corp.,DENN,"no layoffs here - i mean, dennys rocks - with rack bottom prices that's all we need during recesions...","no layoffs here - i mean, dennys rocks - with rack bottom prices that's all we need during recesions...",2009-06-28,0
Dentsply International Inc.,XRAY,Dentsply Layoffs 2019,What's your prediction as it relates to the possibility of Dentsply Layoffs in 2019?,2018-10-30,1
Dentsply International Inc.,XRAY,Dentsply Layoffs 2018,"I haven't been around long time (oh, well) but I already heard about possible job cuts in York.",2017-10-15,0
Dentsply International Inc.,XRAY,Dentsply Layoffs 2017,"If you look at things carefully, use your brain, you may notice that many folks are leaving and there are rumors about layoffs in York.",2016-11-23,0
Dentsply International Inc.,XRAY,Dentsply Layoffs 2016,What is the likelihood of Dentsply layoffs in York in 2016? Please let me know if you have any information.,2015-11-05,0
Dentsply International Inc.,XRAY,2015 Layoffs at DENTSPLY International,"DENTSPLY used to be much better, we used to grow and people were excited about coming to work. Now it's all about the bottomline, nobody cares about workers and on top of all I think we are preparing some kind of layoff for the end of 2015 - I cannot...
read more",2015-03-23,3
DepoMed Inc.,DEPO,Over 300 people to be laid off in Newark,"This is some lousy news to get just after Christmas. More than 300 jobs will be eliminated by Depomed in Newark. Company gets richer and employees pay the price. Makes me sick, to be honest...
read more",2017-12-29,0
DepoMed Inc.,DEPO,Severance Pay,What's your typical severance payment over there at DepoMed? I am with a competitor and just considering jumping the ship.,2013-12-10,0
Desarrolladora Homex S.A.B. de C.V.,HXM,Cuts at desarrolladora in 2013 and 2014,"Any news about this - I heard rumors and wanted to see if someone visiting this site can confirm it. I do not know where we are headed but things do not look good right now. I would expect layoffs in 2014 just based on some internal discussions I had...
read more",2013-12-18,0
Destination Maternity Corp.,DEST,Major closings at Destination Maternity,"Next year is not going to be fun - nearly seventy stores have been slated for possible closing! Some stores will also be reduced in size, which I am sure will mean additional layoffs. What I'd really like to know is how do we know which stores are on...
read more",2018-11-02,0
Destination XL Group Inc.,DXLG,Destination XL Rumors for 2017,"Not sure if you heard but the rumor is that more headcount will be added - this is a positive rumor as it indicates that the company will not be having any layoffs or anything similar to this. If you are in business, you know that growing is the most...
read more",2016-10-13,0
Detour Gold Corporation,DGC,Layoffs are happening but no reports,Nobody is reporting as people are afraid.,2017-07-18,0
Detour Gold Corporation,DGC,Detour Gold....a monster in disguise????,"How wonderful of YET ANOTHER big company that walks in, makes big promises, and lays off local employees over the phone while it rehires individuals from across the province through brokers at much lower wages.......Why not offer those employees you...
read more",2016-01-29,3
Deutsche Bank,DB,Irresponsible Risk Taking,"DB is famous for taking risk irresponsibly. One example is central risk book. Aggregating risk is dangerous. Deutsche Bank Said to Lose Money on Risk-Management Trades -U.S. equity central risk book said hurt by algo performance -Book size once...
read more",2019-03-16,1
Deutsche Bank,DB,Struggles,DB will struggle in 2019. I am curious to see how things will pan out.,2018-10-30,1
Deutsche Bank,DB,Deutsche Bank Layoffs 2019,This is a master thread about Deutsche Bank Layoffs in 2019?,2018-10-30,2
Deutsche Bank,DB,Cary Layoffs,Check this out: https://www.wraltechwire.com/2018/05/25/will-deutsche-bank-layoffs-hit-cary-company-wont-comment/,2018-05-26,0
Deutsche Bank,DB,When will we know if US will be affected?,"Just wondering how long it will be before we find out which US locations will be hit by these layoffs and how bad will it get? Apparently, the bank is still refusing to give any details on the announced cuts, so we are left to stress over it...
read more",2018-05-25,2
Deutsche Bank,DB,Bank layoff dominoes,Which bank layoff is next in this row of dominoes?,2018-05-24,0
Deutsche Bank,DB,"10,000 to be laid off","https://www.reuters.com/article/us-deutsche-bank-strategy/deutsche-bank-plans-to-exit-from-equities-markets-bloomberg-idUSKCN1IO1SA Tell me again how the ""Economy is booming"".....",2018-05-23,2
Deutsche Bank,DB,Deutsche Bank Nucleus Programme,Here is the discussion on HPE's page here on layoffs.com - https://www.thelayoff.com/t/GGpTuHt or @GGpTuHt,2018-05-21,1
Deutsche Bank,DB,massive cuts in progress - media silent and nobody cares,we are talking 100s of people here and there is no coverage,2018-04-26,2
Deutsche Bank,DB,10% of US operations cut,"As proof that not all layoffs, and even mass layoffs, are reported here. This one is huge and yet not a peep. I guess because when you're in complete shock and terror, the last thing you think to do is post it on some forum...
read more",2018-04-26,1
Deutsche Bank,DB,The Bank Layoff / Postbank,"Affecting the retail side only (Postbank), 6000 will be leaving before 2022 - nothing surprising here as retail banks are shrinking across the board. I'd say this is a bit late should have reacted quicker.",2018-03-12,1
Deutsche Bank,DB,"500 layoffs now, mostly on the Investment Banking side","The tip of the iceberg - going forward, they will have to manage the headcount much more aggressively... this is not just Deutsche Bank - it's across the board, GS had layoffs last week on the IB side as well. you can continue to pretend that 'all is...
read more",2018-02-20,0
Deutsche Bank,DB,More updates on layoffs in Europe,https://news.efinancialcareers.com/uk-en/307912/alasdair-warren-deutsche-bank-ibd/,2018-02-09,1
Deutsche Bank,DB,London stuff lay off,"London stuff laid off, including junior/mid-level permanent employees as well as contractors.",2018-01-28,1
Deutsche Bank,DB,layoff started in services in India in Pune and Bengaluru,layoff started in services in India in Pune and Bengaluru. few folks in testing being asked to move on,2017-12-26,0
Deutsche Bank,DB,Major layoffs incoming at Deutsche Bank,"Nearly 1,000 people will be laid off as part of the integration of retail arm Postbank. I'm going to assume all of these will be in Germany, but you never know how these things end...
read more",2017-12-22,0
Deutsche Bank,DB,Layoffs on Track So Far,http://www.nasdaq.com/article/deutsche-bank-to-attain-cost-saving-target-through-layoffs-cm873682,2017-11-09,0
Deutsche Bank,DB,Deutsche Bank Layoffs 2018,Is someone able to kindly comment on layoffs in Germany.,2017-10-15,0
Deutsche Bank,DB,Deutsche Bank Layoffs 2017,Do you think we'll have (new) layoffs in Germany.,2016-11-22,1
Deutsche Bank,DB,"More job cuts (target 10,000 positions) in the pipeline at Deutsche Bank, this time it will be massive","Not sure what to say about this - it's getting sad and stupid here at Deutsche Bank - how many people need to lose jobs before someone wakes up and says something - here in the USA people remain to be quiet and accept cuts, this is not applicable to...
read more",2016-10-18,1
Deutsche Bank,DB,Deutsche Bank: Billions in Fines Mean More Layoffs,"I'm hearing more than 50,000 layoffs ahead. Any comments on the fines that Deutsche Bank will have to pay for their actions? How many people said something and got into trouble? How many people knew what was going on and didn't say anything?",2016-10-03,1
Deutsche Bank,DB,Here's the news...,...and it ain't good. http://www.wsj.com/articles/barclays-cut-in-half-as-europe-slims-down-on-wall-street-1470250141,2016-08-04,0
Deutsche Bank,DB,Deutsche Bank IT Move - Nucleus,"Hi all, Just wondering how you guys are doing, after the Global Nucleus transition to Hewlett Packard Enterprise? Considering that the Wintel, UNIX, VHS, DB, Storage, IT Facilities are now contracted over to Hewlett Packard Enterprise and that the DB...
read more",2016-03-31,2
Deutsche Bank,DB,2016 Layoffs At Deutsche Bank,"PostBank will be spun off, that's going to offload 15,000 people. In addition, they are still messing and outsourcing folks on the back office side, Deutsche Bank has been doing this for a decade or so now. So, more IT jobs will be lost or transfered...
read more",2015-10-27,1
Deutsche Bank,DB,"Deutsche Bank will lay off 23,000 people in 2015 and 2016","Layoffs will happen promptly and many people will be affected. It's likely that DB will not be hitting the US so much but folks that are overseas will get hammered. If they really lay off 25000, that will be about 25% of the overall work force, this...
read more",2015-09-26,3
Deutsche Bank,DB,London cuts,Anybody knows more?,2014-02-05,0
Deutsche Bank,DB,Deutsche Bank Layoffs,"We at Deutsche Bank keep letting people go and keep hiring people at the same time. That's in our DNA. The downsizing process continues, yet, new positions are being born - that's how we keep afloat. You might think that job cuts are detrimental to...
read more",2014-01-31,2
Deutsche Bank,DB,Minor layoffs only,"We've had only minor layoffs so far - please do not exaggerate and it's not all doom and gloom. Yes, we'll try to streamline things but keep in mind that we are hiring quite a bit today and this trend will continue. Deutsche Bank is doing, in my...
read more",2013-12-08,0
Deutsche Bank,DB,2014 Cuts,"The situation at Deutsche Bank is pretty bad right now and morale is low, we are experiencing pressures across the board and it's difficult to say what 2014 will bring. We've seen some cuts in our IT group but 2014 cuts will be much broader, wealth...
read more",2013-12-06,0
Deutsche Telekom AG,DT,Major layoffs coming to T-Systems,"Deutsche Telekom announced it will lay off around 5,600 employees from its IT unit. This is truly massive. It will happen over the following two years, so at least people will not be completely caught off guard...
read more",2018-09-12,0
Deutsche Telekom AG,DT,I heard you guys own TMOBILE,Maybe you ask them to be less rude to customers,2014-07-22,0
Devon Energy Corp.,DVN,Entitled Devon Employees,"I have to assume most folks on this site are complete trolls or they are bitter from a sense of entitlement. For context, I've worked in several different companies across different industries and I've been at Devon for a little less than a decade...
read more",2019-03-21,14
Devon Energy Corp.,DVN,Top 100 company to work for?,Do they still keep the trophies out on the reception desk in the rotunda? I remember laughing about those the day I was laid off in 2016. Thinking Devon wont see any more of those anytime soon.,2019-03-20,3
Devon Energy Corp.,DVN,Were there any more layoffs these days?,"I know the official announced part of the layoffs has finished, however, I donćt doubt for a second that they will continue unannounced for a longer period of time. So, were any Devon folks laid of these days and ig they were at what locations?",2019-03-19,5
Devon Energy Corp.,DVN,The job market,"I heard a lot of opposing opinions on the topic of how strong or weak is the job market right now in our industry. How hard is to land a job at another company? I see a lot of people complaining how hard it is, but i didn't see many of them that...
read more",2019-03-14,6
Devon Energy Corp.,DVN,They keep doing the same thing,"I keep wondering why is it that this company keeps believing that laying off experienced employees will solve problems that were created by inadequate upper management? Has this ever worked in the many previous attempts they've tried it? Nope. And...
read more",2019-03-14,10
Devon Energy Corp.,DVN,Jobs Jobs Jobs,"For the IT folks there are jobs out here. You might have to move to Texas, but you may prefer to so you don't have to look at the ""Big Drill"" everyday in OKC. USAA has a big data center in Plano and their main office in San Antonio. I'm actually...
read more",2019-03-13,1
Devon Energy Corp.,DVN,Chief Accounting Officer doesn't want a big event,"He would rather everyone comes to work fearing a layoff for a month. Another big win for morale, way to go.",2019-03-13,7
Devon Energy Corp.,DVN,Who is next to get cut?,I can;t be naive to that point to believe that the layoffs won’t continue and that what they announced is just a fraction of the workforce to get cut. I’m certainly curios what departments and what type of workers will they be targeting next.,2019-03-13,3
Devon Energy Corp.,DVN,Bozo,"Worked with this young man on several occasions. He doesn’t know much and certainly isn’t a “subject matter expert” by and stretch of the imagination. The word “imposter” comes to mind when I think him. Probably spends a good deal of time talking to...
read more",2019-03-13,7
Devon Energy Corp.,DVN,Can’t believe they are doing this to the employees,"My supervisor called me on the phone to come to a conference room. My manager, female HR for my dept, supervisor & security were all seated in the room. My manager read a script about how my position was eliminated, he appreciated my work & was so...
read more",2019-03-12,15
Devon Energy Corp.,DVN,How does getting laid off at Devon look like?,"I don’t want to refresh bad memories of the folks that got laid off, or put salt on their wound, but if someone who went through the process could post what do the actual layoffs look like. Is zou manager present or just the person from HR? Do they...
read more",2019-03-11,8
Devon Energy Corp.,DVN,How are you surprised by this?,"It's been announced for 3 years they will do these cuts years thru 2020. They are selling Canada and the N TX plays. If you're in these areas you are prime target. But also non degree personnel are also prime target. Why you don't have an exit plan...
read more",2019-03-11,1
Devon Energy Corp.,DVN,Our G&A is about to look hella good!!!!!,"Remember, in order to be beautiful butterflies we have to cut the fat! “A group of scientists from Oregon have discovered that butterflies experience a great loss in body fat during metamorphosis.”...
read more",2019-03-11,0
Devon Energy Corp.,DVN,No more Sunday evening Devon dread!,"Best I’ve felt about an upcoming Monday in so long. I didn’t realize how much that place drains your spirit and resolve. I feel bad for the ones not laid off, prepare to be over worked and under appreciated. Deuces Devon. ✌🏼",2019-03-11,1
