company,ticker,title,body,date,replies
Ahold Delhaize Group,DEG,Recommending DHG,DHG was my first job. I loved it,2018-10-30,0
Ahold Delhaize Group,DEG,Delhazie Layoffs 2019,What's your prediction as it relates to the possibility of Delhazie Layoffs in 2019?,2018-10-30,0
Ahold Delhaize Group,DEG,Food Lion Layoffs 2014,Any news here?,2014-07-22,1
Ahold Delhaize Group,DEG,Any news about Feb & Mar 2013 - I've heard a number of things conflicting each other,Any news about Feb & Mar 2013 - I've heard a number of things conflicting each other,2013-02-12,1
Ahold Delhaize Group,DEG,77 to be let go next thursday,77 to be let go next thursday,2013-02-12,0
Ahold Delhaize Group,DEG,Potential layoffs are coming to Delihaize - I heard that announcement about downsizing will take place in August and that the cuts will take...,Potential layoffs are coming to Delihaize - I heard that announcement about downsizing will take place in August and that the cuts will take place right after that.,2012-07-27,0
D.R. Horton Inc.,DHI,What happened in Oklahoma?,What happened in Oklahoma to cause the multiple terminations? Poor sales seems unlikely.,2018-05-18,0
DAG Media Inc.,DAGM,Internship,"I am looking for internship, do you guys hiring?",2013-12-05,0
DAG Media Inc.,DAGM,As we at dag are not embracing new media guess what will happen to us?,As we at dag are not embracing new media guess what will happen to us?,2009-07-24,0
DCP Midstream Partners L.P.,DPM,Dark Clouds Are Gathering Again,"Today it's all about greed for these big corporations and the lies they sell to the worker are demeaning but they don't give a damn.They don't do all the dirty work at these terminals (propane) in all sorts of nasty weather year round. Don't forget...
read more",2019-03-05,0
DCP Midstream Partners L.P.,DPM,"200 LAID OFF TODAY, TRUTH",no body text,2016-04-05,1
DCP Midstream Partners L.P.,DPM,"About 10% let go today. All employees, not just upper management got bonuses.",no body text,2016-04-05,1
DCP Midstream Partners L.P.,DPM,Just Got Laid Off,"Blood Bath today. Made it through last Jan's but not this one. Adios, Energy Industry! I am taking my ball and going home.",2016-04-04,5
DCP Midstream Partners L.P.,DPM,2016 DCP Midstream Layoff,"DCP Midstream started LayOffs March 11, 2016. Employees were told that layoffs would continue and firing would continue for some time. Management has said time and time again that there would be no more layoffs. Bonuses were awarded so upper...
read more",2016-03-12,9
DCP Midstream Partners L.P.,DPM,Layoffs in Oil Industry,"Just look at this site about layoffs in all upstream and midstream companies - there are thousands of messages on many boards here. It's crazy. WFT, SLB, HAL, BP, Shell, you name it - you will find it here. I think we will have a very difficult 2015...
read more",2015-02-01,1
DCP Midstream Partners L.P.,DPM,2015 Layoffs at DCP,"Do you know if you will be having layoffs any time soon? Also, are you hiring right now? I have 20 years of experience and I was recently let go so I am looking at any other options as many companies are having layoffs in 2015. Please let me know.",2015-01-30,2
DCT Industrial Trust Inc.,DCT,DCT Industrial Trust layoffs June 2018,"Nearly 60 employees will be laid off by DCT Industrial Trust as part of the Prologis. Those who believe it will stop at this are very naive. I am positive we'll have more consolidation layoffs in the following months...
read more",2018-06-04,0
DDR,DDR,DDR layoffs April 2018,"DDR seems to be on a roll when it comes to layoffs. Another 50 jobs will be cut, mostly at the headquarters. Frankly, I don't think anybody should consider themselves safe, whatever the location...
read more",2018-04-25,0
DDR,DDR,Why no posts here?,"We all know what's happening. Look at ""Latest Posts"" link in the main menu, 1000s of companies are having posts.",2018-04-11,1
DDi Corp.,DDIC,"Mikel Williams, President and CEO of DDi, stated ""The second quarter reflects another solid performance","Mikel Williams, President and CEO of DDi, stated ""The second quarter reflects another solid performance. Despite the continued challenging market environment, we are managing our business well - as reflected in our margins and profitability. During...
read more",2009-08-06,0
DDi Corp.,DDIC,DDi Corp,"DDi Corp. provides printed electronic circuit board engineering and manufacturing services in North America and Asia. DDi specializes in engineering and fabricating multilayer printed electronic circuit boards. The company has customers in various...
read more",2009-06-28,0
DG FastChannel Inc.,DGIT,Downsizing and Job Cuts in plans,We'll have an interesting year - 2014 will be worse than 2013 and you'd agree that 2013 sucked big time for us.,2014-02-07,0
DHX Media Ltd.,DHX,"Got acquired? Don't trust the ""no layoff"" promises","Shortly after DHX Media absorbed Nerd Corps last year, there was a lot of reassurances from mgmt that no layoffs would be happening... and then shortly after, the layoffs started. DHX is acquiring smaller media companies like crazy, it's their MO, so...
read more",2016-11-02,0
DIRECTV,DTV,Confusing Offerings,"T has a big streaming choice problem (by Business Insider) Now that AT&T has closed its Time Warner acquisition, it has a lot of streaming services to manage. It already has DirecTV Now, which has two tiers. It also has WatchTV and HBO Now. And it's...
read more",2019-03-15,1
DIRECTV,DTV,DIRECTV Layoffs 2019,Do you think there may be small/medium/large DIRECTV Layoffs in 2019?,2018-10-30,5
DIRECTV,DTV,What a mess.....,Man did DTV get dicked over by AT&T. DTV is decimated and almost worthless now.....Time Warner soon to be the next victim,2018-05-28,2
DIRECTV,DTV,DTV Latin America IPO,any latest info on the IPO for Latin America? Can't always rely on media for info.,2018-03-13,0
DIRECTV,DTV,California layoffs,"Anyone in California hear of any layoffs in 2018 for us in broadcasting, engineering or IT? Specifically in El Segundo, Long Beach & San Diego?",2018-02-08,2
DIRECTV,DTV,Any recent updates,Any recent surplus updates for Directv ET employees? Haven’t heard anything in a while so I want to be somewhat prepared since February is around the corner,2018-01-24,0
DIRECTV,DTV,Customers are NOT important,"I find that working for DirecTV is such a challenging and often NOT very rewarding job. I feel sorry for the long time customers who have given their loyalty to us. Tech Support is supposed to be there to assist with their needs especially when we...
read more",2018-01-22,1
DIRECTV,DTV,Blind promoting the blind,"We have some really inept leadership at DirecTV. There are a few who are constantly making terrible decisions and who keep promoting employees who couldn’t find their way out of a paper bag. This isn’t a popularity contest for crying out loud...
read more",2018-01-13,0
DIRECTV,DTV,"700 laid off, lots more to come","As it seems, AT&T is made of lies. Nothing new there. 700 people were just laid off from DirecTV, with more to come. So much for promises of new jobs... Timing is awful as well, two weeks before Christmas. Do these people have no soul? If you are...
read more",2017-12-20,2
DIRECTV,DTV,Confirmed layoffs February 2018,Heard of massive cuts in california including Long Beach and el segundo in February 2018. No one will be spared and no amount of company loyalty will matter . Rumors of upto 33% cuts in workforce as a result of trickle down At&t takeover cuts,2017-12-18,3
DIRECTV,DTV,DIRECTV Layoffs 2018,"I thought that we were safe (oh, well - wrong), even tough many competitors were cutting people, do you think we'll cut here in El Segundo.",2017-10-15,11
DIRECTV,DTV,"AT&T and DirecTV face thousands of complaints linked to overcharging, promotions",http://www.cbsnews.com/news/complaints-att-directv-bundled-services-directv-customers-promotions-overcharging/,2017-05-17,1
DIRECTV,DTV,Ever since at&t took over DirecTV.....,"Customer service at an all time low. Being lied too about pricing, their union employees don't want to do the work and are doing poor installations. Contractors are held to a high standard and are out performing in house installers. I've worked for...
read more",2017-02-10,2
DIRECTV,DTV,"As long as DirecTV SW VP still there, AT&T will go down with its DirecTV Now !","These bad eggs are still at the helm, especially fat Con",2017-01-18,5
DIRECTV,DTV,QP1502 Error Code,"I guess I should not be saying anything else... ""QP1502"" kind of sums it for all of us. https://twitter.com/hashtag/qp1502 #qp1502",2017-01-13,1
DIRECTV,DTV,how much does a senior principle architect and a director make as base salary at DirecTV El Sugendo office?,"Glassdoor shows Senior principle architect $155k - which seems to be pretty low. A friend who got offered as consultant (15+ years of experience) as network architect is evaluating how much salary he would make if he would get offered full time and...
read more",2016-12-24,3
DIRECTV,DTV,DIRECTV Layoffs 2017,"No layoffs, yes layoffs??? Gossip… Rumors? What's correct, there is a ton of rumors about layoffs here in El Segundo.",2016-11-23,7
DIRECTV,DTV,Phoenix DOC is Closing Dec 27th. We were just given notice today.,no body text,2016-10-28,2
DIRECTV,DTV,https://directvnow.com,It is up since last night: https://directvnow.com,2016-10-27,3
DIRECTV,DTV,Working at DIRECTV,"DIRECTV was a great place to work, integrity was number one as well employee satisfaction. Since ATT took over we have seen a need for unions, cuts in benefits and overall pay crappy shifts, layoffs and putting up with ATT flipping accounts for a...
read more",2016-10-18,4
DIRECTV,DTV,Has anyone heard of layoffs in Phoenix area?,no body text,2016-10-03,6
DIRECTV,DTV,"California Broadcast Center in Long Beach, CA","Layoffs are decimating the California Broadcast Center in Long Beach, CA. Our inept, ignorant, headhunter manager has brought in 20 years old inexperienced kids that we more experienced broadcast engineers have been forced to train. It's taking 3 of...
read more",2016-10-01,9
DIRECTV,DTV,"In short, DirecTV management ruined the company and let employees hanged to dry !","I wrote a white paper 9 years ago sounding the alarm and send to DirecTV management. I urged them to move to streaming and combining satellite delivery with streaming. They ignored my paper for they were busy milking the company to enrich themselves...
read more",2016-10-01,5
DIRECTV,DTV,"ATT has announced they will move to streaming, what will happen to us broadcasting center guys and our engineering guys?",Sounds like what they are describing there can be done with just an app on TV or tablet. Then satellite and set top can all be abandoned. Any thoughts?,2016-09-29,4
DIRECTV,DTV,some qa analyst contractors in mobility dept in elsegundo are getting paid $55 /hour plus overtime pay. They just do manual testing from 5years,"From last 5years they are working as manual QA analyst/UAT analyst , they donot do any automation as directv testing is completely manual testing. They are enjoying good pay with Manual QA Analyst/UAT analyst in elsegundo directv mobility dept. I...
read more",2016-08-30,2
DIRECTV,DTV,software developer: up to $40/hr,"$40/hr? really? hah you guys are pathetic lol: Software Developer El Segundo CA Long Term Contract (Up to 36 months) DOE, up to $40.00 Hr. We are searching for a Software Developer to work on a long term contract basis for a client of ours in El...
read more",2016-08-23,4
DIRECTV,DTV,October/1st quarter layoffs for DTV call centers???,Hearing rumors of more layoffs for DIRECTV call centers in OCT or 1st qt 2017. ANYONE heard anything of this? Team leader positions up???,2016-08-19,2
DIRECTV,DTV,Rumor about end of year surplus,"I heard there will be a huge surplus in LA before the holidays seasons. Mostly in engineering and ops. I am surprised it took this long for AT&T to decide after failing to integrate DTV. Well, this failure does not surprise me, however, when AT&T...
read more",2016-08-19,2
DIRECTV,DTV,Just lay us off and quit trying to make our jobs HELL!,"We see a video about the preferred scheduling and how they saved 5k hours in OT, yet they slam us in the queue every day and let the early crew go home but an hour later they offer OT and cancel all offline activities, so the late shift gets screwed...
read more",2016-06-09,4
DIRECTV,DTV,News about Legacy DTV Call Centers,"Hey, all - I'm a legacy DTV guy in El Segundo, but have made a number of connections with folks in the DTV call centers, and I just wanted to get some news about how much damage has been done out there. I've heard that Huntsville got slammed today...
read more",2016-05-23,4
DIRECTV,DTV,DTV layoffs? Any news? Monday?? How many??? Anyone?,Anyone have insight on numbers/% of TL's to be laid off Directv Boise? Managers? SR managers?,2016-05-22,1
DIRECTV,DTV,Don't forgot to check the AT&T section of this site https://www.thelayoff.com/at-and-t,no body text,2016-05-07,2
DIRECTV,DTV,CSr's for DTV,"Many CSr's for DTV got there notice AT&T wishes to take over so there laying them off. Also many contractors in areas at&t Uverse is located or not having contract renewed Uverse techs will be installing DTV now,",2016-04-27,4
DIRECTV,DTV,The next round of layoffs will be begin sometime next week at El Segundo and the LABC.,Situation is hopeless.,2016-04-27,1
DIRECTV,DTV,Many CSRs for DTV got their notice - AT&T wishes to take over so they are laying them off.,Also many contractors in areas AT&T UVERSE is located or not having contract renewed UV techs will be installing DTV now,2015-12-26,0
DIRECTV,DTV,Lay offs starting up again at the Los Angeles Broadcast Center. Check around you. Going to be ugly.,no body text,2015-12-13,6
DIRECTV,DTV,DIRECTV Layoffs 2016,What is the likelihood of DIRECTV layoffs in El Segundo in 2016? Please let me know if you have any information.,2015-11-05,0
DIRECTV,DTV,Ergen will kill you all in the next 5 years.,"The former DirecTV engineering prior to 2005 was great. They were the one pioneering the whole sat delivery idea. The new DTV management after 2005 got rid of them and hired a bunch of incompetent ""engineers"" (they were technicians, actually. Look at...
read more",2015-09-24,1
DIRECTV,DTV,Will AT&T cut off DirecTV contractors?,no body text,2015-09-20,5
DIRECTV,DTV,PMO,Our PMO is the best PMO crew on the plannet,2015-09-15,5
DRS Technologies Inc.,DRS,DRS layoff 2018,"DRS Technologies Melbourne FL massive layoffs 2018. Layoffs will continue throughout the year. Lot's of people will be looking for work in Brevard. This was posted recently in an old thread. Any chance somebody here knows more about this? Any more...
read more",2018-04-27,0
DRS Technologies Inc.,DRS,DRS Layoff,"I will never forget who people who work for DRS Layoff and I lost my good employees who are my favoriate person in my life but I accepted a hard one and move on and nothing I cant do with DRS in 2015 that was a big hit my life that the company have...
read more",2017-06-07,2
DRS Technologies Inc.,DRS,2014 Layoffs @ DRS Technologies,I might be joining DRS - are you maybe letting people go right now (I have to be very careful),2014-05-07,1
DRS Technologies Inc.,DRS,Salary information,Can I find salary information for DSR Tech somewhere? I do not have anything to add to the layoff discussion but I'd appreciate if somebody is able to answer my question. Good luck and I hope you'll never have layoffs at DSR.,2013-12-10,0
DRS Technologies Inc.,DRS,"if you have been layed off, contact me on how to protect your 401k from any loses and recieve a 20% bonus.","if you have been layed off, contact me on how to protect your 401k from any loses and recieve a 20% bonus.",2012-08-23,1
DRS Technologies Inc.,DRS,It's pretty sure that we'll see another round of lay offs here at DRS during Summer/Fall 2012,It's pretty sure that we'll see another round of lay offs here at DRS during Summer/Fall 2012. The numbers do not add up as DRS has more employees than we need.,2012-07-18,1
DRS Technologies Inc.,DRS,test,test,2012-04-18,0
DST Systems,DST,Again....,Yet another rumor that tomorrow 3/20 will be D-Day... Does anyone know if there is any truth to this most recent rumor? Any layoffs happen this month anywhere in this company?,2019-03-19,4
DST Systems,DST,SS&C No Pay Rises,I have just been told that there are no pay rises this year across the whole of SS&C. Is this true? How often often does SS&C do this or is this the first time.,2019-03-19,21
DST Systems,DST,Bill Stone Video Update,Can’t wait 😊,2019-03-18,6
DST Systems,DST,Medical leave = gone,"Just got a return text from a now former co-worker. He went out on a medical leave the beginning of February and was due back today. Few of us chipped in and bought coffee, bagels, etc...to welcome him back and he was a no-show. Someone else asked...
read more",2019-03-11,4
DST Systems,DST,Layoffs,"With so many experienced people layed off in June 2018, I don’t see another layoff in the forcible future.",2019-03-05,6
DST Systems,DST,Feb 28th bonus?,Anyone see a bonus come thru yet?,2019-02-28,16
DST Systems,DST,"If you’re over 50, been laid off and having a hard time finding a new job","Its not because you’re old. It’s because you are most likely difficult to get along with in the workplace and you’ve made a bad name for yourself, people talk, companies call colleagues at other companies to check you out before they even extend an...
read more",2019-02-26,9
DST Systems,DST,I heard layoffs are March 1st...,Bonus paid and a pink slip.,2019-02-26,9
DST Systems,DST,Why...,Is it really not happening until April...,2019-02-25,3
DST Systems,DST,Layoff,"I heard they are going to pay out the bonuses the End of February, then instead of your your performance raise in April, they will lay you off with all getting a 2 week severance.",2019-02-15,2
DST Systems,DST,Any news of layoffs for this month?,Just curious about what your are hearing around your areas.,2019-02-14,4
DST Systems,DST,Everyone’s had a year to find a new job,"Everyone’s had a year to find a new job. If you’ve been in your role a very long time, like over 5+ years, never grown or had a promotion, you’re a gone. My group is slow as molasses. We all know it’s just a matter of time, and that time is most...
read more",2019-02-14,5
DST Systems,DST,Layoffs in April 2019,There’s a rumor.,2019-02-13,4
DST Systems,DST,No more layoffs for 2019 and 2020,Enjoy.,2019-02-12,9
DST Systems,DST,A few of us in my group got stock options last year after the merger,"Does that make us all safe from future layoffs? I mean they would not give us stock in the company if they were going to lay people off, right???",2019-02-08,7
DST Systems,DST,Ice storm,"I hear that due to the upcoming ice storm, they have placed all critical personel in rooms at the Marriott. If you weren’t offered a room - you are on the lay-off list.",2019-02-06,3
DST Systems,DST,Well???,When is the layoff?,2019-02-01,15
DST Systems,DST,Today,"Let it be today, the day they let some of us go....",2019-01-30,6
DST Systems,DST,Is it gonna happen,"The end of Jan 2019 is coming soon, any news or talks of layoffs??",2019-01-17,7
DST Systems,DST,Employees still here including myself are and have been on borrowed time,"2,500 employees gone give or take 500 through layoffs and attrition since early 2017. Likely layoffs to come early summer and fall of 2019. Constent game of musical chairs with leadership. Company provides no direction for the future except to get...
read more",2019-01-16,9
DST Systems,DST,SS&C lettet,"I was let go from BFDS in October 2017 after 24 years and employed elsewhere in Nov 2017 to current day. Last night I grabbed my mail and had a 9x12 envelope with the SS&C logo. There was a jumble of sentences on page 1&2 basically indicating that...
read more",2019-01-09,8
DST Systems,DST,Long term medical disability - Whats the point!?,"Have heard of at least three cases now of people on chemo be let go or forced out basically that were trying to get on long term disability .....never believing long term medical disability again as a ""benefit"". If you truly wont honor the benefit...
read more",2019-01-07,8
DST Systems,DST,Who Says the job market is good?,"Wages have not increased in years. Of course if you're talking about low-level jobs at places like retail and fast food, yeah, they are hiring and maybe you get a buck raise for leaving Burger King for Taco Bell. Try getting a Vice President job...
read more",2019-01-04,6
DST Systems,DST,Who is looking for a new job?,"Most of the people I know are already hunting down new jobs to get away from this mess. Is this a company wide thing? I really hope it is, a mass exodus of employees might be what the DST management needs to realize they can't treat us the way they...
read more",2019-01-03,17
DST Systems,DST,I heard a rumor that in 2019 there. will. be. layoffs.,Just thought I’d pass it on.,2019-01-03,4
DST Systems,DST,Someone on this site is obviously bored @person constantly talking stocks and debt,"Quit trolling this board with speeches then praising yourself troll. No one cares.......... Here is a thought. Why not find a discussion board that is actually dedicated for something like that versus on a layoff site where people just want to know...
read more",2019-01-03,7
DST Systems,DST,Debt is what paralyzes you in any situation,"Markets go up. Markets go down. Position yourselves to take the opportunities each present. Money is made going up AND going down. Layoffs happen during either, but more so in a down market. This is all you need to understand to know what's around...
read more",2019-01-02,12
DST Systems,DST,2019 is going to be horrible,"Well, given that December 2018 was the worst in stock market history since 1931, you can bet your last DST dollar that massive layoffs will be happening everywhere in all companies. So it doesn’t really matter where you work, the good times are over...
read more",2019-01-02,12
DST Systems,DST,thelayoff.com = rumorville site not a preaching forum,"I don't know anything new about job layoffs at DST. So I am done with my thought process on this. Now is the next persons turn to state if they know anything or not. Not that hard. Apparently is rocket science to some on here. Yes we get there are...
read more",2019-01-02,10
DST Systems,DST,Christmas bonus,Did layoff ruin bonuses?,2019-01-01,3
DST Systems,DST,Starting the new year with layoffs,"Been hearing about a major layoffs round sometime in January. Any truth to that? Frankly, wouldn't surprise me one bit for DST to start off a year with layoffs. That seems to be the only thing upper management knows to do lately to pretend they are...
read more",2018-12-18,42
DST Systems,DST,Did you hear the big news yet?,Discuss.,2018-12-18,16
DST Systems,DST,Just be done already,"Are they doing more layoffs at the end of Dec or not, this whole not giving any information is exhausting!",2018-12-17,6
DST Systems,DST,Didn't Dst always say they would never layoff?,"As a downtown supporter, didn't they pledge to never downsize? How does Dst former upper management feel about the owner's changes?",2018-12-14,7
DST Systems,DST,Reminder of Who We're Wealing With Here,"This article is in one of these threads iirc: DST employees were hit Tuesday with massive layoffs, but the decision to fire 6% of the back-office providers’ staff should have been no surprise to those listening to the firm’s CEO speak to investors...
read more",2018-12-13,3
DST Systems,DST,More cuts coming,"They are changing the game up some. The large layoffs are being replaced with smaller discreet layoffs. With their overall objective of offshoring all coding efforts and their need to meet the numbers, it is inevitable. Their agenda has not changed.",2018-12-11,4
DST Systems,DST,"Dst means ""don't stay there"", layoff warning of old","In 1979 the joke was Dst stood for ""don't stay there"", and anyone wanting to be appreciated did not stay at dst. Dst is toxic. The layoffs effect the hang on group that should have never stayed 20 yrs. Sadly some made it their whole career, while...
read more",2018-12-11,6
DST Systems,DST,Sort your priorities,"How can people be thinking about bonuses and raises right now? We've been having constant layoffs, which we know are going to continue well into the following year. This has stopped being about bonuses a while ago, now people are lucky if they still...
read more",2018-12-10,4
DST Systems,DST,Dst should laid off its upper management,Should cut management 20 yrs ago. They created criticism as if it was a virtue,2018-12-08,5
DST Systems,DST,Definite,"Apparently SS&C has confirmed to the labor dept, that the big lay-off will be in April. The biggest yet!",2018-12-06,12
DSW Inc.,DSW,DSW Layoffs 2019,Do you predict that there will be DSW Layoffs in 2019?,2018-10-30,0
DSW Inc.,DSW,No coverage of DSW layoffs,"Why is this not in the news when hundreds of people laid off, The DSW website states they are adding million hours in payroll to the stores and incentives to all full time associates which there are none now! Where is the media coverage of...
read more",2018-06-01,1
DSW Inc.,DSW,What was the criteria?,Does anyone what was the criteria they used to keep the assistant manager and to let go of the other assistant manager?,2018-05-29,1
DSW Inc.,DSW,"Major layoffs at DSW, May 2018","Half of the managerial staff members and full time associates laid off without warning. During layoffs legal made a point of emphasis on the fact that this wasn't a financial decision and that the company was losing money by graciously doling out...
read more",2018-05-28,0
DSW Inc.,DSW,DSW Layoffs 2018,Someone please confirm RIFs or layoffs in Columbus.,2017-10-15,6
DSW Inc.,DSW,DSW Layoffs 2017,I'd like to see if someone can give us more info or details about job cuts in Columbus.,2016-11-23,0
DSW Inc.,DSW,LAYOFFS HAPPENING TODAY 6/21/16,no body text,2016-06-21,0
