company,ticker,title,body,date,replies
Danaher Corp.,DHR,"2008 was brutal, 2014 will turn to be as bad",Danaher has major market and internal issues,2014-01-15,1
Danaher Corp.,DHR,Danaher RIF,Any news?,2014-01-05,1
Danaher Corp.,DHR,Each company may be affected,"AB SCIEX; Arbor Networks; Beckman Coulter; ChemTreat; Danaher Specialty Products; DEXIS; Esko; Fluke; Fluke Networks; Gems Sensors Gendex; Gilbarco Veeder-Root; Hach; i-CAT; Instrumentarium Dental; KaVo; Kerr; Kollmorgen; Leica Biosystems; Leica...
read more",2013-12-17,2
Danaher Corp.,DHR,News and rumors,"No news but a ton of layoffs on Danaher. Do some research and you will note that electronic testing, environmental testing, motion-sensing and recording and product identification business are doing pretty well now-days (maybe electronic testing not...
read more",2013-12-17,0
Danaher Corp.,DHR,Not layoff related but here it goes anyway,"Not layoff related but here it goes anyway. It might be a good time for Management and Execs to really start listening to employees that have true customer knowledge and stop depending on software to tell you how to run and maintain a business. There...
read more",2013-09-17,0
Danone,BN,2015 Layoffs,"Do you think we may have layoffs here in the USA in 2015? I heard some rumors but nothing can be confirmed, so any info you may have is very much appreciated.",2015-03-12,0
Darden Restaurants Inc.,DRI,Prediction,Darden will be fine,2018-10-30,0
Darden Restaurants Inc.,DRI,Darden Layoffs 2019,"If the market makes a turn soon, do you think there will be Darden Layoffs in 2019?",2018-10-30,0
Darden Restaurants Inc.,DRI,Layoffs in Corporate Office (2016),The plan is to cut 20 or so people from our corporate office,2016-01-25,0
Darden Restaurants Inc.,DRI,408 Managers To Be Laid Off by Darden,"Darden is planning to layoff 408 managers along with 2,100 waitstaff, kitchen staff, etc by 2016 Q4. Merely due to the new integrated ordering system that guests can place their order from. Also, many sexual harassment and fraternization complaints...
read more",2016-01-25,1
Darden Restaurants Inc.,DRI,Darden Layoffs 2016,What is the likelihood of Darden layoffs in Orlando in 2016? Please let me know if you have any information.,2015-11-05,2
Darden Restaurants Inc.,DRI,"Possible cuts / layoffs at: Olive Garden, Red Lobster, Longhorn Steakhouse, Bahama Breeze","Just heard about it, not sure how reliable the info is, especially about Red Lobster",2014-09-12,2
Darden Restaurants Inc.,DRI,Downsizing again in 2014,"That's what I heard, the numbers are still bad.",2014-01-30,1
Darden Restaurants Inc.,DRI,No rumors? Come on guys?,No rumors? Come on guys?,2013-09-25,0
Darden Restaurants Inc.,DRI,any news for DR? i hear we are closing few places,any news for DR? i hear we are closing few places,2013-09-19,0
Darling International Inc.,DAR,Darling Ingredients Layoffs 2019,Have you heard anything about potential Darling Ingredients Layoffs in 2019?,2018-10-30,0
Darling International Inc.,DAR,Darling Ingredients Layoffs 2018,Whenever you think there will be no layoffs/job-cuts/RIFs they change the approach. Now all people are talking about job cuts in Irving.,2017-10-15,0
Darling International Inc.,DAR,Darling Ingredients Layoffs 2017,I need to know when layoffs will happen (need to make a major purchase and I am anxious) here in Irving.,2016-11-23,0
Darling International Inc.,DAR,Darling Ingredients Layoffs 2016,What is the likelihood of Darling Ingredients layoffs in Irving in 2016? Please let me know if you have any information.,2015-11-05,0
Darling International Inc.,DAR,Darling Ingredients Layoffs,Do you have any updates here? I hear that there might be layoffs in IT in 2015 or 2016.,2015-08-13,0
Dassault Systemes S.A.,DASTY,Dassault Downsizing 2014,This is happening as I write this - hang in there,2014-03-05,0
Dassault Systemes S.A.,DASTY,2014 challenges for Dassault,"DS used to be a fairly good company - growth was there, people were excited about coming to work. things are changing, budgets are smaller, there is less money in the pot. I hate it recently. Too much back stabbing, there is not enough room to grow...
read more",2013-12-18,0
Dassault Systemes S.A.,DASTY,whats the connection between autodesk and Dassault,whats the connection between autodesk and Dassault,2013-10-23,0
Dassault Systemes S.A.,DASTY,Autodesk news http://mashable.com/2012/08/23/autodesk-lays-off-7-of-entire-staff/ The world market is not favorable to PLM companies at the...,Autodesk news http://mashable.com/2012/08/23/autodesk-lays-off-7-of-entire-staff/ The world market is not favorable to PLM companies at the moment.,2013-10-23,0
Dassault Systemes S.A.,DASTY,"I heard about upcoming layoffs at Poughkeepsie, NY - does anyone have additional information? I've been with the company for over 3 years and...","I heard about upcoming layoffs at Poughkeepsie, NY - does anyone have additional information? I've been with the company for over 3 years and I recently bought a home near work and I would absolutely hate to have to move my family again. I would...
read more",2013-02-14,0
Datalink Corp.,DTLK,"If earnings keep going down, you know layoffs are coming","Datalink has been good to me over the years, cannot complain, but 2016 will be a difficult year",2015-12-29,0
Datascope Corp.,DSCP,What's the best way to get the job at Datascope Corp. Layoffs?,no body text,2013-12-16,0
Dawson Geophysical Co.,DWSN,O&G not using Dawson much?,"WTI more or less steadily up since 2016, from about $30 to nearly $70. Are O&G outfits still not spending money on new seismic surveys? Or just not with Dawson?",2018-05-03,0
Dawson Geophysical Co.,DWSN,"currently working, poor management, working in 5th year and looking for work outside exploration",no body text,2018-04-20,0
Dawson Geophysical Co.,DWSN,Is Dawson still in business? It's kind of quiet on this layoff site?,Any updates?,2017-10-03,1
Daxor Corp.,DXR,Daxor is a public company traded on ASE under DXR ticker,"Daxor is a public company traded on ASE under DXR ticker. Daxor We labels itself as an innovative medical instrumentation and bio-tech company. They state that they manufacture the BVA-100 Blood Volume Analyzer, the first instrument approved by the...
read more",2009-06-28,0
Dayton Power & Light Co,DPL,Any updates on the recent layoffs?,Anybody has more info on DP&L???,2018-03-20,0
DeVry Inc.,DV,DeVry prof has book out on college success,Should be an interesting read. https://www.amazon.com/dp/B07MFCK33B,2019-03-19,2
DeVry Inc.,DV,"How many DeVry students are ""grifters""?","How many DeVry student veterans are ""grifters""? If you have names, please let me know. Also, please let the VA and ED-OIG know. https://www.rallypoint.com/status-updates/4461465",2019-03-19,0
DeVry Inc.,DV,Disabled veteran calls out DeVry at House Subcomittee,"The House Subcommittee on Labor, Health and Human Services, Education and Related Agencies invited former for-profit college student Eric Luongo to testify about his experience at DeVry University. Loungo, also a disabled veteran, said he received...
read more",2019-03-15,17
DeVry Inc.,DV,Hello Tomorrow Here Today,Today is the 91st day of the transition. Any news?,2019-03-11,5
DeVry Inc.,DV,So which one of you finally decided to talk?,http://www.cracked.com/personal-experiences-2246-i-teach-at-for-profit-college-heres-why-its-scam.html,2019-03-10,4
DeVry Inc.,DV,Argosy studemts are coming over!!!,"DEM get ready for good session. Argosy got into Federal trouble....and guess what???Devry will be there, to take All these students. I HOPE this time, its a cleaner transition compared to Westwood, ITT Tech!",2019-03-08,5
DeVry Inc.,DV,Former DeVry President has been everywhere in the subprime college boom and bust,The rich get richer and the workers get shafted. How many of you wish you were this guy during this subprime college crash? https://www.thelayoff.com/t/XWhWLIh https://www.thelayoff.com/t/XWjRIW3,2019-03-06,1
DeVry Inc.,DV,Fewer jobs in subprime education,Hope workers here can find more legitimate work. https://www.linkedin.com/pulse/college-meltdown-means-less-lower-enrollment-revenues-dahn-shaulis/?published=t,2019-03-05,0
DeVry Inc.,DV,has anyone felt the wave????,a few locations have been hit already!!!,2019-03-01,12
DeVry Inc.,DV,Thanks Myrtle Beach...,"Why isn't anyone else saying anything? ""Unresponsive Faculty Managers and Infrequent Opportunities"" Pros Students, tools, teaching resources, competitive pay. Cons Faculty Managers aren't very responsive. Very little support from higher. Infrequent...
read more",2019-02-28,4
DeVry Inc.,DV,Workers Expose Subprime College Crash in Real Time at TheLayoff.com,"TheLayoff.com has provided a platform for real-time observations and information for more than a decade. In the case of the subprime college crash, workers chronicled the collapse of Corinthian Colleges, ITT Tech, Education Management Corporation...
read more",2019-02-25,0
DeVry Inc.,DV,"Not even a seat at the table, or even part of the conversation...",https://www.chronicle.com/interactives/Trend19-MegaU-Main,2019-02-24,6
DeVry Inc.,DV,Reorg/Right-size,"Well the long anticipated change is on the horizon. Expect changes to come in the next 30 days and a reorg to come before the new fiscal year. JB was voted to stay for one reason and that's to ""right size."" Hello Tomorrow is near.",2019-02-23,3
DeVry Inc.,DV,The misguided initiative,"Most of my online students reject the idea of attending a live synchronous event, while my onsite students detest the online modality. Trying to combine them into this hybrid, kluged onsite/online “Frankenstein monster” is another naive, misguided...
read more",2019-02-19,8
DeVry Inc.,DV,90 Minute Weekly Live Sessions for all classes?,"Just learned in the training about the 90 minute weekly live sessions required for all classes starting in July? I can see that being great for math or accounting type classes, but for all general education classes? I can't get my students to attend...
read more",2019-02-18,11
DeVry Inc.,DV,Cogswell Education headquarters is so small...,"Has anyone checked out Cogswell Education headquarters in Greenwich, CT? It looks tiny. https://www.regents.nysed.gov/common/regents/files/1118hea1.pdf",2019-02-15,3
DeVry Inc.,DV,Paying for required training,How is DeVry circumventing the legal requirement to pay employees for manditory training such as CBC201?,2019-02-12,11
DeVry Inc.,DV,This!,"I have many students who register but never submit a single assignment. They post one blank post per week so that the system records an ""academic event"" so they don't get dropped from the class. The only explanation for this behavior is that they are...
read more",2019-02-12,8
DeVry Inc.,DV,Beware the Ides of March,"March 11 is the 91st day of the transition. There has been a call for faculty CVs, due March 8th. ""Hello Tomorrow: The Next Chapter in the Journey"" begins March 12th. Emails March 10th? Meetings March 11th? Anyone worried?",2019-02-08,23
DeVry Inc.,DV,Thanks to the couargeous person who posted on GlassDoor,"""Advice to Management"" ""I worked at DeVry University for two years and the first 6 months was okay. However doesn't align with my educational philosophy. This university is very numbers based. There is no sense of care for what the students want and...
read more",2019-02-07,6
DeVry Inc.,DV,Ghost campuses and ghost classes drain resources,"@XmobjDa-4kdv, how long can Cogswell continue to have ghost campuses and ghost classes?",2019-02-05,7
DeVry Inc.,DV,May 20th focused visit from Higher Learning Commission,What should the HLC look for in their focused visit?,2019-01-31,18
DeVry Inc.,DV,Frigid Cold!,"Chamberlain is closing both tomorrow and Thursday, asked my boss about DeVry and couldn’t get a commitment about Thursday. We live in the same area and share buildings, how does that make sense. Is AK afraid to make decisions or does she just not...
read more",2019-01-29,2
DeVry Inc.,DV,Where will DeVry downsize?,"I've heard that some of these locations are actually ghost towns. Online Education Arizona Glendale Center Mesa Center Phoenix Campus California Colton (Inland-Empire) Center Folsom Campus Fresno Campus Long Beach Campus Newark Campus Pomona Campus...
read more",2019-01-29,5
DeVry Inc.,DV,Hard Feelings,"As one who did quit, I came to believe that no matter what I did (and my gifts and productivity were considerable), I could be fired over not achieving a 3.6 or higher. I taught ""killer"" courses, which students despised because they were so weakly...
read more",2019-01-23,10
DeVry Inc.,DV,Has technology become a distraction?,"We hear so much about how great group projects are; how ""engagement"" increases with the use of IFF; and how much the use of video and other technology enhances the learning experience. To some degree, this is true; however, I feel like we've become...
read more",2019-01-22,16
DeVry Inc.,DV,Deceived by DeVry,"In 2019, DeVry University continues to deceive consumers through its DeVry website and online recruiting. As a subsidiary of Cogswell Education and Palm Ventures, a shoe-string operation in comparison to its previous parent company, matters could get...
read more",2019-01-22,0
DeVry Inc.,DV,Is DeVry still involved with Reboot?,A veteran advocate friend of mine in California tells me that Reboot is a big scam. Is DeVry still involved with them? https://www.nvtsi.org/ https://www.nvtsi.org/workshop/ https://www.nvtsi.org/locations/devry-university/,2019-01-22,0
DeVry Inc.,DV,Veterans Education Success looking for whistleblowers--You can remain anonymous,"Veterans Education Success is looking for people who can tell us what's going on at the school (including accounting, enrollment, instruction) especially as it pertains to veterans. You don't have to give your name...
read more",2019-01-17,0
DeVry Inc.,DV,College Meltdown shows few signs of slowing in 2019,"""For-profit colleges and community colleges continue to be hardest hit. But small rural colleges and Historically Black Colleges and Universities (HBCUs) are also struggling. Even second-tier public colleges and universities have been declining in...
read more",2019-01-11,2
DeVry Inc.,DV,DEM,"This is huge surprise to me, some DEM advisors DON'T even have Bachelors Degree? Your ""selling"" something that you don't even have or understand .... That the DeVry way...promote ""SELLERS"" not experienced, educated, rotating students 100 to 150 per...
read more",2019-01-08,11
DeVry Inc.,DV,NCES numbers,"These numbers from NCES suggest that several DeVry sites are defunct or in the process of failing. CO, IN, MO, NV, NC, OK, TN...and these numbers are old. DeVry College of New York 1,528 DeVry University-Arizona 672 DeVry University-Colorado 221...
read more",2019-01-07,6
DeVry Inc.,DV,DeVry taking Art Institute students,About two dozen Art Institutes closed December 28th. And DeVry is taking Ai students. The Art Institute schools were owned by the Dream Center (DCEH) https://www.artinstitutes.edu/closed-school-information-page https://www.thelayoff.com/dceh,2018-12-31,2
DeVry Inc.,DV,If Skunk Odor Mated with Venomous Frog Slime,"If Skunk smell mated with venomous frog slime, the resulting spawn would be for-profit education. It is as toxic, mind-killing, and soul-crushing as its worst critics say. But, the problem isn't exclusive to for-profit education: anywhere students...
read more",2018-12-30,1
DeVry Inc.,DV,Yale University School of Management,Does anyone else see an ad for Yale University on this page?,2018-12-27,0
DeVry Inc.,DV,Cogswell Workload,"Former colleagues still employed: now that you are with Cogswell (or is it Palm Ventures--nothing on their page) what is your workload like? Still 40 to a class? Any humanities or writing faculty--how do you grade so many? Can you? Or is it just no...
read more",2018-12-23,12
DeVry Inc.,DV,Why the radio silence from Cogswell?,"No press release. No ""Welcome to the team"" message. Nothing from the new owners. Just seems strange.",2018-12-14,14
DeVry Inc.,DV,Be prepared...,"If you don’t already have a Plan B in place, it’s time to have one. Change is coming in the new year. Expect changes and it may be your number pulled. Things will not remain status quo...expect a significant shake up. Those that remain, the future...
read more",2018-12-12,3
DeVry Inc.,DV,"That's all she wrote. Frankly, one expected more...","Adtalem Colleagues, We are pleased to announce the transition of DeVry University (DVU) to Cogswell Education is complete. Cogswell Education owns Cogswell College, the second oldest operating college in California, and a regionally accredited...
read more",2018-12-12,18
DeVry Inc.,DV,I Guess All is Well,"The boards have been quiet, so I guess all is well: class sizes are lovely and small, perhaps no more than 20 in a class. DeVry has raised its standards and is only admitting prepared students, who actually want to learn. Quality of instruction has...
read more",2018-12-03,11
Dean Foods Co.,DF,Dean Foods is done,"Latest plant closures were the last nail in the coffin. The sad thing is management acts like what they did solved our problems - when in reality things went to hell. Any gain was short-term - something that long-term well-being of the company will...
read more",2019-03-22,0
Dean Foods Co.,DF,Dean Food Bankruptcy,Probabiliy of Bankruptcy for Dan Food - this is something that should be taken with a grain of salt https://www.macroaxis.com/invest/ratio/DF--Probability-Of-Bankruptcy,2019-03-14,2
Dean Foods Co.,DF,Reyes Holding Company to purchase Alta Dena city of industry north and south. Is this true?,no body text,2019-03-07,0
Dean Foods Co.,DF,Dean Foods in violation as of March 1st,http://www.themilkweed.com/MWP-022019%20Story%20Month.pdf,2019-03-03,2
Dean Foods Co.,DF,Dean Foods Le Mars,"With the announcement of Deans in financial trouble. I wonder if Le Mars is a target? Most of the vet employees make over $23.00 an hour. Including jobs as easy as blowmold and filler ops who just watch jugs fill up. Even caught the panelboard op...
read more",2019-03-02,17
Dean Foods Co.,DF,Now what??,LOOKS LIKE THE NEW CLOWNS IN CHARGE HAVE NO IDEA WHAT'S GOING ON !! TIME FOR A FIRE SALE ?? LOOKS LIKE THEY WILL BE TAKING ANOTHER CHUNK OUT OF THE COMPANY!! TRUELY A SAD DAY FOR THE REST OF US,2019-02-28,1
Dean Foods Co.,DF,Rumor: Dean Food considers bankruptcy?,True or False?,2019-02-26,2
Dean Foods Co.,DF,Huntley Plant,"Country Delight Inc., (President Joe McMahon) which transports about 52 million pounds of milk a year and serves about 400 stores in the Chicago area, is looking to buy the former Dean Foods plant in Huntley with the hope of expanding distribution...
read more",2019-02-13,1
Dean Foods Co.,DF,City of industry North,We just lost half of our Costco accounts to another dairy and we are expecting nine layoffs. Does anyone know the future of Alta dena North?,2019-01-31,2
Dean Foods Co.,DF,STOCK DOWN 4% 1-28 9% TODAY,WHAT THE HECK ARE THESE NEW CLOWNS UP TO ? DOES ANYONE HAVE ANY IDEAS? LOOKS LIKE I WILL BE GOING DOWN WITH THE SHIP !!!! I AM NOT THE CAPTAIN JUST A PEON LMAO,2019-01-29,2
Dean Foods Co.,DF,This will not help,"Is Dean Foods really this desperate to cut costs? Layoffs, plant closures, outsourcing… What is next? Reducing or finding loopholes in benefits they are providing is old news, but even there they’ve been really pushing it lately. Maybe, just maybe...
read more",2019-01-25,0
Dean Foods Co.,DF,They get it wrong and we pay the price,"I’m sure there are a lot of companies where you would be overworked for nickel and dimes, but at least at them, one could have a stable job and not worry if his position is going to be terminated, outsourced, will his plant close etc. At Dean Foods...
read more",2019-01-25,1
Dean Foods Co.,DF,Dean spiralling downward,"My time with Deans is coming to an end. Over the past 15years I have watched this company fall apart at a rapid pace. Management that has absolutely no clue how to run a dairy. Watching customers leave day in and day out. Being forced to do more work...
read more",2019-01-24,1
Dean Foods Co.,DF,How to know if your plant is closing?,"I'm worried because two of our managers left in the last two weeks, both voluntarily. One went to another Dean Foods plant and the other quit. This has me paranoid - do they know something we don't? Is there anybody here from previously closed plants...
read more",2019-01-24,2
Dean Foods Co.,DF,"Leaders didn’t care about us when we were doing ok, why would they care now","I left Dean a couple of months ago and that departure opened my eyes. We weren’t valued as employees back when the company wasn’t is as many problems as it is today. Why would they bother to treat us any better in these conditions? The fact is the...
read more",2019-01-23,0
Dean Foods Co.,DF,Why do we need layoffs?,"We have such high turnover at Dean Foods that it makes absolutely no sense to have layoffs. Enough people are leaving on nearly daily bases that it would be enough to just stop hiring and achieve the savings they want. And yet, instead, the company...
read more",2019-01-23,0
Dean Foods Co.,DF,2 Additional Clowns Hired at the Top,"Nothing will change, they will make a ton of money though. Shame.",2019-01-22,2
Dean Foods Co.,DF,Any news from the plant manager meetings in Dallas last week?,Just wondering if anyone has any new info to share from the plant manager meetings last week.,2019-01-21,3
Dean Foods Co.,DF,Anybody know any news about city of industry plant closing this year?,no body text,2019-01-20,1
Dean Foods Co.,DF,EMERGENCY EXECUTIVE BOARD MEETING TOMORROW 11-11-19,Looks like we find out soon what's going on!!!,2019-01-10,6
Dean Foods Co.,DF,I worked for both Garelick and Tuscan Lehigh . When I first started it was a great job once new ceo took over in Dallas it was all down hill.,no body text,2019-01-08,0
Dean Foods Co.,DF,Dean Foods is collapsing,"Dean Foods is collapsing and will be the biggest collapse in CPG history. Shares sinking, closing Lynn Plant and losing 500 customers, market basket just kicked Garelick Farms to the curb and Stop & shop is next to kick out Garelick farms. Milk was...
read more",2019-01-02,1
Dean Foods Co.,DF,Are we nearing bankruptcy?,"Been looking at what happened to Sears, and I'm starting to think Dean Foods is headed in the same direction. From everything I'm seeing it looks like that absent some miracle, we'll be filing Chapter 11 sooner rather than later. Am I just being...
read more",2018-11-29,13
Dean Foods Co.,DF,HOW LOW CAN IT GO!!!,STOCK PRICE DOWN TO 5.03 TODAY. DOES ANYONE KNOW HOW LONG THESE CLOWNS CAN KEEP FILLING THEIR POCKETS BEFORE WE GET BOUGHT OUT? SOONER THE BETTER!!!!,2018-11-28,2
Dean Foods Co.,DF,Whats in the future for Deans food,wondering since the routes have been downsized to 4 day work weeks with 2 men doing same its(which to me is more costly) will the men eventually go back to 5 day work weeks after the restructuring is completed?,2018-11-18,1
Dean Foods Co.,DF,Blue bunny looking at Dean Foods?,Blue bunny execs being showed around belvidere ice cream plant. Any other plants have these visitors?,2018-11-08,1
Dean Foods Co.,DF,Any new news?,Does anyone have any information after the Q3 call and the stock dropping in value of roughly 25%??,2018-11-07,1
Dean Foods Co.,DF,Dean Foods Layoffs 2019,Post any information about potential or actual Dean Foods Layoffs in 2019?,2018-10-30,3
Dean Foods Co.,DF,Braselton Mayfield layoffs starting on September 16,"I know this was already mentioned before, but now there is more info on Mayfield closing plant in Braselton, so I thought I would share it here...
read more",2018-09-04,3
Dean Foods Co.,DF,Dean Foods layoffs soon,"It's happening very soon everywhere, every level, every location. They will be coming looking for heads to make Q4. Found this in another thread. Any chance we can get some more info on this? Can anybody confirm if this is even true or not? It sounds...
read more",2018-08-28,3
Dean Foods Co.,DF,There is life after Dean Foods.,"Last month I got out of a toxic frustration factory filled with hypocrisy, double standards, back-stabbers and ego-maniacs. Everyone should think about their health and sanity, my husband said he’s starting to see the woman he married, I found...
read more",2018-08-25,2
Dean Foods Co.,DF,Is the end near,"Work at the sharpsville plant is a complete disaster. With the changes in the plant...stores rarely get what they order and when they do its up to a day late sometimes...the new ordeting system is a failure...customers are leaving in droves...
read more",2018-08-23,7
Dean Foods Co.,DF,Plant closings in new year?,"Has anyone else heard that in January more plants closures may be announced. If so, does anyone have a clue who might be getting the axe?",2018-08-18,1
Dean Foods Co.,DF,Milking the business to last drop,"Dean Foods' stock plunges toward 7-year low after J.P. Morgan turns bearish. Folks hope your not F———ED! You better have a bug out plan, and start before your identified as Dean trash as the place closes down, they changed the game so that they get...
read more",2018-08-17,19
Dean Foods Co.,DF,Dean Foods Tweaks Executive Pay Plan After Cutting Profit Forecast,Us and them,2018-08-14,1
Dean Foods Co.,DF,Dean Foods' Huntley plant will be no more by the end of September,"A decade or so ago the idea of Huntley plant closing would have been laughed at. That's no longer the case, unfortunately. The plant will close by the end of September, and all 131 employees will be laid off as a result of that. Of course, instead of...
read more",2018-07-11,2
