company,ticker,title,body,date,replies
Hikma,HIK,200 will be laid off by Hikma,"Execs expect to wrap up the manufacturing slim-down before year’s end. On the distribution side, Hikma is closing a Memphis, Tennessee-based center later this year... Executive Chairman Said Darwazah told investors on the company’s fourth-quarter...
read more",2018-03-17,1
Hill International Inc.,HIL,Layoffs are happening,"Layoffs are happening at Hill International Inc. they are doing quietly, but they keep laying people off. The lies stated by the interim CEO, that they are trying to grow the company and not to worry about anything happening to your job is all BS...
read more",2017-07-16,2
Hill International Inc.,HIL,No layoffs at Hill,"Nothing more to add, as of 2017, things are stable.",2017-05-25,0
Hillshire Brands,HSH,Tyson Foods acquisition,"Do you think that we will be affected (from the layoff perspective) by the acquisition. Also, does anyone know how is the corporate culture at Tyson and if there are any cultural differences between Tyson and Hillshire",2014-06-10,1
Hilltop Holdings Inc.,HTH,Any updates here?,Is Hilltop still in business at all? I cannot find any info on layoffs...,2017-08-08,0
Hilton Worldwide Holdings Inc.,HLT,Good times,Hilton is expanding big time - good times for hotels,2018-10-30,0
Hilton Worldwide Holdings Inc.,HLT,Hilton Layoffs 2019,Is this going to be an interesting year as it relates to Hilton Layoffs in 2019?,2018-10-30,0
Hilton Worldwide Holdings Inc.,HLT,Hilton Layoffs 2018,"I never knew that executives can be so sneaky, to tell you one thing and then to hit you with something else - the mood is pretty bad here in McLean.",2017-10-15,0
Hilton Worldwide Holdings Inc.,HLT,Hilton Layoffs 2017,Job cuts later this year in McLean.,2016-11-22,0
Hilton Worldwide Holdings Inc.,HLT,Hilton Layoffs 2016,What is the likelihood of Hilton layoffs in McLean in 2016? Please let me know if you have any information.,2015-11-05,0
HireRight Inc.,HIRE,All software tester in US being laid off on 01/11/2016,All software tester in US being laid off on 01/11/2016,2016-01-12,0
Hittite Microwave Corp.,HITT,Merging this thread,I recommend merging this thread with Analog Devices,2016-04-12,0
Hittite Microwave Corp.,HITT,Analog Devices Acquisition,"M&A activity always brings layoffs, you can expect that Analog Devices moves quickly and eliminates all redundant jobs - any folks working for finance or HR should be concerned. Hittite Microwave will not be an exception to this rule.",2014-06-10,0
Hittite Microwave Corp.,HITT,It's ugly right now,"It's a horrible situation, people are very anxious here at HM. I do not know what 2014 will bring but I can tell you that we cannot continue to operate this way - get over with it please...",2013-12-18,0
Hittite Microwave Corp.,HITT,"Been developing ICs for a while, I've seen the cycle, it goes up and down","Been developing ICs for a while, I've seen the cycle, it goes up and down. Right down it's going down for all including HITT",2013-10-07,0
Hittite Microwave Corp.,HITT,It looks like things will be getting ugly this fall - I think 2014 will be ugly too- we are having major difficulties in the market and the...,It looks like things will be getting ugly this fall - I think 2014 will be ugly too- we are having major difficulties in the market and the competition is brutal,2013-08-22,0
Hoku Scientific Inc.,HOKU,"All there units (Hoku Materials, Hoku Solar and Hoku Fuel Cells) are doing good? You can look for jobs at Hoku here: http://tbe.taleo.net/NA1...","All there units (Hoku Materials, Hoku Solar and Hoku Fuel Cells) are doing good? You can look for jobs at Hoku here: http://tbe.taleo.net/NA12/ats/careers/jobSearch.jsp?org=HOKUSCIENTIFIC&cws=1",2010-06-30,0
Holly Corp.,HOC,HollyFrontier 2015 Layoffs,"Oil prices are dropping and something has to give, we'll have layoffs for sure the only question is how big the layoffs will be.",2015-01-11,3
HollyFrontier Corp.,HFC,What are the latest rumors for HollyFrontier?,"Anything on the acquisition front for HollyFrontier, any rumors or speculations? Post info if you have it.",2018-10-09,0
HollyFrontier Corp.,HFC,Fired after 20 years of service.,"I lost my job today for a very poor excuse after 29 years of exceptional service. I am hearing there are another 8 were fired at three other locations. This is similar to what happened last year around this same time. Five employees were fire just...
read more",2017-11-03,1
Hollywood Media Corp.,HOLL,Things can be better overall - 2014 and 2015 still have chance to be good years,"I mean everyone can improve, think in terms of Ad Sales, MovieTickets.com, Intellectual Property Division, Tekno Books, NetCo, all of the entities can do better",2014-07-24,0
Hologic Inc.,HOLX,Hologic Surgicsl Layoff,Heard that 40 surgical sales reps were let go this week. Rumor or fact??,2017-10-28,0
Hologic Inc.,HOLX,Hologic is small,"And they do not have many layoffs, it's fairly stable and there will be no layoffs in 2017 I am sure about that",2016-11-08,0
Home Depot Inc.,HD,We're not so different,"Came here out of curiosity and sadly find you guys are getting it just as bad as us. As much as I hate to see that is there anyway you can take Marvin back? JCPenny shot us down and we're getting desperate. We're so tired of hearing we're gonna use...
read more",2019-03-01,0
Home Depot Inc.,HD,Severance question?,"Severance not paid for 60 days. And saying last day of employment is 60 days. What’s really going on Home Depot. Can you please clarify this, @XtReQZY-6xrw? Are you saying that nobody from the people who were just laid off will receive their...
read more",2019-02-12,3
Home Depot Inc.,HD,HDE JOINING HDI,"HDE is merging with HDI. Large branches have 6-12 months, smaller 4-6 months. OM’s in the operations center were told to expect their severance packages and termination in 4 months. There is a FIM swat team going around the country trying to clean up...
read more",2019-02-10,1
Home Depot Inc.,HD,Strange Happenings,"Ever notice that some topics have many replies and suddenly all but one or two disappear? Or that one of your replies is suddenly reposted as a new topic? This deal is managed, pruned, weeded, and manipulated. HD and other companies have input here...
read more",2019-02-09,1
Home Depot Inc.,HD,Hired Sears executives and then think it won’t happen here?,"I was lucky. Saw the writing on the wall in April. Just got out in January after watching the systematic destruction following the Sears model. Hired Sears executives and then think it won’t happen here? This may be the new definition of insanity...
read more",2019-02-08,0
Home Depot Inc.,HD,They train us to sell having never done so themselves,"As a loweser I can tell you we have similar levels of incompetence and mismanagement. We have layers of highly paid managers who basically forward us emails we’ve already read. They train us to sell having never done so themselves. They have us use...
read more",2019-02-07,0
Home Depot Inc.,HD,We are famous,"Home Depot said it was laying off less than 1,000 people, but declined to give further specifics. However, a thread on TheLayoff, a website in which laid-off workers discuss developments, highlighted the national reach of the cuts...
read more",2019-02-07,1
Home Depot Inc.,HD,Will there be more layoffs today?,Is there anybody in the know who could tell us if more layoffs are expected today?,2019-02-07,2
Home Depot Inc.,HD,Gross incompetence and mismanagement,"This has been years in the making, ever since HD Core took over running installation services in 2012 whereas before they were autonomous profitable units. What happened Tuesday is the direct result of gross incompetence and mismanagement. I heard...
read more",2019-02-07,1
Home Depot Inc.,HD,Layoffs,Layoffs Today Home Depot Stops Installations,2019-02-05,2
Home Depot Inc.,HD,HDE and HDI going away?,Hearing rumors that the HDE and HDI programs will be discontinued. Can anyone confirm that this is true?,2019-02-05,49
Home Depot Inc.,HD,Home Depot Layoffs 2019,Is there going to be any reorg or Home Depot Layoffs in 2019?,2018-10-30,1
Home Depot Inc.,HD,Home Depot Layoffs 2018,Is it possible that we'll have job cuts in Atlanta.,2017-10-15,5
Home Depot Inc.,HD,sales assoc.,I heard yesterday that due to the economy HD will be cutting jobs in the az market including Mgrs.,2017-06-29,1
Home Depot Inc.,HD,"Home Depot Hendersonville TN asking employees for ""voluntary"" layoffs.",no body text,2017-02-11,0
Home Depot Inc.,HD,"Home Depot Terminating Its Business Analysts, QA Analysts, QSI Systems Engineers who build dev and testing environmrnts, QA Managers","And Project Managers to forgo testing production code and hardware changes to production Stores to reduce operating costs. Developers will develop, test, not document, and push their code into production since they now produce zero defects, and...
read more",2017-01-19,2
Home Depot Inc.,HD,It's all good,Just saying. Lowe's in a meltdown mode though. We'll get hit soon too...,2017-01-17,0
Home Depot Inc.,HD,Home Depot Layoffs 2017,"What do you think, what is the likelihood of having layoffs in Atlanta.",2016-11-22,8
Home Depot Inc.,HD,Home Depot is not a good place to work at,"If you are asking yoruself where to work - please do not come here as managers are super bad and also they invest very little in people. Do your research on the internet and learn about pay which sucks and it's not enough even to cover basic...
read more",2015-11-12,2
Home Depot Inc.,HD,2014 & 2015 Leadership Layoffs (Home Depot / Corporate),"Over the past year or so Home Depot has been quietly laying off some of their most successful IT Leaders. This group includes multiple executive levels (SVP, VP, Senior Director, Director, and Sr. Manager). While the total number of layoffs is...
read more",2015-11-12,1
Home Depot Inc.,HD,Home Depot Layoffs 2016,What is the likelihood of Home Depot layoffs in Atlanta in 2016? Please let me know if you have any information.,2015-11-05,2
Home Depot Inc.,HD,Expo Layoffs (Home Depot),"Being a well-known retailer of home improvement and construction products, Home Depot, while enjoying a large customer market share, had to opt for a major employee layoff in 2009. We planned to lay off 7000 employees in the year, with our intention...
read more",2015-04-06,1
Home Depot Inc.,HD,No Layoffs in 2015,"I've been with HD for about seven months now and I really enjoy working here. I am in Finance so sometimes deadlines can be frustrating, but overall this is the best company I worked for so far. Managers are typically good, they set expectations well...
read more",2015-04-02,1
Home Depot Inc.,HD,2015 Corporate Layoffs at Home Depot,"I heard some rumors that we might be having layoffs here at Home Depot corporate offices in Atlanta maybe in Q2 or Q3 of 2015. Now, this is not confirmed and I have no clue if any info is public but what I heard is that there will be some...
read more",2015-01-29,1
Home Depot Inc.,HD,List of Home Depot Stores Closing (2014 and 2015),"Anyone has the list, I'd appreciate if you can post it here.",2014-09-12,1
Home Depot Inc.,HD,2009 Layoffs at Expo,"I was let go back in 2009 I used to work at a Expo Design center, but HD Bath and YardBIRDS were affected as well. 2009 was pretty bad for the company, but most stores were not affected. I think overall five thousand people were let go. At the same...
read more",2014-08-29,0
Home Depot Inc.,HD,List of Home Depot Stores Closing in 2014,Do you maybe have the list of stores that will be closing in 2014?,2014-07-22,0
Home Inns & Hotels Management Inc.,HMIN,Homeinns Hotel Group Layoffs 2019,Do you think there will be Homeinns Hotel Group Layoffs in 2019?,2018-10-30,0
Home Inns & Hotels Management Inc.,HMIN,Homeinns Hotel Group Layoffs 2018,Do you think we'll have layoffs in Shanghai.,2017-10-15,0
Home Inns & Hotels Management Inc.,HMIN,Homeinns Hotel Group Layoffs 2017,How about layoffs in Shanghai.,2016-11-23,0
Home Inns & Hotels Management Inc.,HMIN,"No job cuts, good","Homeinns Hotels are typically good and there are no layoffs, at least I am not awae of any - the owners are Chinese so are pretty much all employees - they operate out of Shanghai - no layoffs, no downsizing or job cutting but they are an OK company...
read more",2016-03-01,0
Honda Motor Co. Ltd.,HMC,Is the closure of the Swindon plant a beginning of a process?,"An isolsted case, or a begining of a wider process of cutying the workforce? Do mass layofgs await us in 2019?",2019-02-18,0
Honda Motor Co. Ltd.,HMC,Honda is closing the Swindon plant,"Not sure if this site is restricted to layoffs at companies in the US but I’m sure that there are some folks from the UK on this site so here it goes for those that aren’t informed on this. Honda is set to close is Swindon car plant by 2022, which...
read more",2019-02-18,0
Honda Motor Co. Ltd.,HMC,September layoffs at Honda,"Honda executive ordered by corporate office required layoffs of a large number of permanent full-time staff in their sales departments for service and vehicles. Layoffs began yesterday 9-20-2017 by corporate officers who were present with no use of...
read more",2017-09-22,1
Honda Motor Co. Ltd.,HMC,"No layoffs for Honda, growth in the USA",Adding about 300 positions right now. We are expanding in Ohio. Things are good for now but there is always that fear of a downturn and how that may affect us... https://example.com/xSOguQEV21,2017-09-18,2
Honda Motor Co. Ltd.,HMC,Honda Aircraft Company (HondaJet),Where are the listings for the way Steve is running HACI into the ground?,2016-08-04,0
Honda Motor Co. Ltd.,HMC,2015 Layoffs at Honda,Do we have any updates? Things can be better.,2015-04-01,1
Honeywell International Inc.,HON,HQ employee migrations,Any word? I thought the drawdown was supposed to occur mid Feb,2019-03-01,1
Honeywell International Inc.,HON,P193,"I work for PSE. My manager’s manager called me today and offered the same position at ISC. It is P193. Following is written in the Offer Letter: ‘Failure to accept this position will be considered a voluntary termination’ Does anyone else have...
read more",2019-02-28,11
Honeywell International Inc.,HON,48 hrs the new norm,"Manager just finished telling me that 48 hrs is the new standard work week and that it will be tracked. Vacation hours must be made up. Reason given was business needs billable hours to make aop. Of course I don’t have a project to work so just...
read more",2019-02-27,15
Honeywell International Inc.,HON,Aero closings,"In Aero they announced the closing of Renton, Olathe, and Coon Rapids. Do you think that is ""settled down?"" When was this announced? Has it been confirmed? I'm not sure how I could have missed something of that magnitude, but if it's true, I...
read more",2019-02-27,2
Honeywell International Inc.,HON,"HUB Strategy RIF's are definitely being prepared now, targeting developed market first.","Once the individual contributors are removed and work transferred to vendors, the managers and directors will be next. They need to keep the managers/directors long enough to put their names on the RIF paperwork. Then they will be next. First round...
read more",2019-02-26,2
Honeywell International Inc.,HON,Honeywell Rooftop reductions,What's the update here on Honeywell Rooftop reductions? Do you have more details on how things are playing out.,2019-02-26,0
Honeywell International Inc.,HON,Fewer layoffs this year?,"Do you think we'll be looking at fewer layoffs this year? Things seem to have settled down a bit, and I'm starting to be cautiously optimistic.",2019-02-26,5
Honeywell International Inc.,HON,I wouldn't be too quick to leave,"Two people I know who left Honeywell on their own (quit, not laid off) are regretting their decision and trying to find ways to come back. One of them landed a new position that he says is nothing as advertised during the interview, and the other is...
read more",2019-02-25,10
Honeywell International Inc.,HON,Honeywell SAP US job postings,Honeywell SAP job posting on all job portals. Is it good to work for Honeywell? How's the work environment? How's the growth ?,2019-02-24,7
Honeywell International Inc.,HON,Engineer's Week Lunch,"Yep, we got our lunch. Management did NOT want people filling their plates and/or going back for seconds so servers were used for each item (one for the pulled chicken, pork, or veggi-burger (for the Indians) ) , another for beans, coles; and one to...
read more",2019-02-23,12
Honeywell International Inc.,HON,So what are people getting for raises?,3.2%,2019-02-22,24
Honeywell International Inc.,HON,Sr Engineering Directors fired?,Anyone heard the news about 2 Senior Aero Engineering Directors for PSE-GROE being fired? Anyone have any details as to why?,2019-02-21,20
Honeywell International Inc.,HON,PMT LSS Group something is not right.,All the DCS folks being moved out of LSS group to special projects group. Not hiring replacement techs for those retiring or leaving. Betting no to low raises. Think sale or layoff of LSS is in the works.,2019-02-21,2
Honeywell International Inc.,HON,Raises this year,I saw on a post we were getting 20% raises this year? Anyone else heard this?,2019-02-21,11
Honeywell International Inc.,HON,Get ready for a bumpy ride this year,"Folks, here we go -...
read more",2019-02-17,4
Honeywell International Inc.,HON,Is the movement to Olathe just the beginning? What happens after?,"I’m almost sure that this reduction and movement of jobs just the beginning of a wider restructuring practice that will take place company-wide. What sites could be impacted next? And what criteria in reducing jobs and their movement will they be...
read more",2019-02-15,0
Honeywell International Inc.,HON,Wait... Honeywell owns the Olathe facility?,"Wait... Honeywell owns the Olathe facility? I thought Honeywell paid for the construction of it back in 1998 and then sold it in order to lease it back because somehow that reduces expenses... Did that never happen or did Honeywell buy it back? I was...
read more",2019-02-14,3
Honeywell International Inc.,HON,Employee Of Honeywell,"With all the plants being relocated why isn't there grief counseling being offered for loss of family members. Honeywell has always said we are a family and we work together to support our Honeywell family. Well our new CEO has no or Ho definition of...
read more",2019-02-14,6
Honeywell International Inc.,HON,HOS,"What about Honeywell HOS, any body knows any information, from our site it is not more active,dead.",2019-02-13,6
Honeywell International Inc.,HON,Is moving jobs to Olathe the end of it?,Curious whether this movement of jobs to Olathe is an isolated case or is it just to the beginning of a company-wide effort of moving various segments of business under one roof? Are there rumors of any other movement?,2019-02-11,9
Honeywell International Inc.,HON,AERO EEI Increase to 1.2,"If Aero engineering is targetted to book 48hrs per week, why are holidays preloaded as 8hrs still and not 9.6hrs in TWB? Am I missing something ....more than just a screw b/c I work for this company?",2019-02-11,18
Honeywell International Inc.,HON,Engineering and IT saved!!! ViceP KM is retiring April 30!,Honeywell Filing with SEC and on Honeywell.com reports VP of Engineering and IT retires April 30th. Thank you Darius. Finally did something we can all appreciate and approve of!,2019-02-09,15
Honeywell International Inc.,HON,More to Come,"CEO announced a footprint reduction last year and hid strategy.... I'm on the Aerospace side and in the last 4 months I know Albuquerque, part of Grier, Renton, Wichita, and Coon Rapids all officially announced closure and I don't think that is...
read more",2019-02-09,6
Honeywell International Inc.,HON,Honeywell Service Center[ONE STOP],"Has anyone had a issue with trying to get a hold of someone at the service center today?[ONE STOP] Everytime I try to call about my pension[which I haven't gotten yet in 13 months] The recording says its a 1-2 hour wait. Or call back the next...
read more",2019-02-08,9
Honeywell International Inc.,HON,What’s behind the office closures and moving the jobs to Olathe?,Can’t believe they just decided this. Is there a wider picture behind this? What are the reasons for this big move? I see that a lot of people could be affected.,2019-02-08,6
Honeywell International Inc.,HON,ex Morristown Aero,Does anyone know how many former Morristown Aero/Defense folks are still in Morris Plains?,2019-02-08,3
Honeywell International Inc.,HON,I know how you feel Coon Rapids. It happened to us.,no body text,2019-02-08,5
Honeywell International Inc.,HON,I have worked for this company for 41 years. The last 10 have been hell since the HOS syste,I have worked for this company for 41 years. The last 10 years have been hell since the HOS system came into place. New supervisors are out of control with no support from laudry HR. This a bull sh-- commany and I hope no ever has to work for it.,2019-02-08,4
Honeywell International Inc.,HON,Aero Engineering now are getting higher OT demands,"So it sounds like our revered Aero Engineering VP Ellis is demanding that his organization be mandated to increase their overtime from the 10% to now 15%. Count me in as one of the folks that will test what not doing that incurs! BS to the extreme...
read more",2019-02-08,18
Honeywell International Inc.,HON,Worst than ever?,"Just one employees opinion: I've been with Honeywell for 30 years. It has given me a good income, interesting assignments, and new friends. However listening to the engineers and technicians I come in contact with daily, it seems that things are just...
read more",2019-02-07,4
Honeywell International Inc.,HON,"Wichita, Kansas Aero R&O shop closing and moving to Olathe, Kansas",This a rumor 20 years in the making that is finally coming true. Standby for details!!!,2019-02-07,12
Honeywell International Inc.,HON,Greer Honeywell,"Management mistreating employees using their bully tactics they are being told it's mandatory to work on holidays and firing employees for using their personal and vacation time. Just to get a day off . If you have never seen a circus run by a monkey...
read more",2019-02-07,2
Honeywell International Inc.,HON,Resideo forum board,"Some of you probably know this already, but since I've just noticed the link on the ""related companies"" section here, here it goes anyways. Resideo has it's own forum page on TheLayoff. Here is the link: https://www.thelayoff.com/resideo-technologies...
read more",2019-02-05,0
Honeywell International Inc.,HON,Sadcom Ottawa,"It used to be called SATCOM Ottawa. Now, it is Sadcom. A revolving door. The best, the finest are leaving and will leave. Little leader, do you think your youngish Czech dudes can do Satcom? Yah, dream on. Little leader, do you think doing Agile, a...
read more",2019-02-01,3
Honeywell International Inc.,HON,Updates to USA hub strategy?,"Heard the next push for people to get pushed to hubs is going to be April 1 for Corp The first deadline for the Charolette NC hub is tomorrow February 1 or they will be RIFd per the letter they received in December Anyone heard the terms of moves...
read more",2019-01-31,8
Honeywell International Inc.,HON,Honeywell Greer r&o closing,no body text,2019-01-30,5
Honeywell International Inc.,HON,Performance Reviews,When do these normally happen each year? I can't wait to get my 0.5-2% raise!,2019-01-29,8
Honeywell International Inc.,HON,Dysfunctional Internally Focused Company,"Honeywell is a miserable place to work that even its supplies eye roll when hearing that name. The culture uses HOS as a way to achieve a level of standardization to shut down the operations then move to a low cost country. Management that changes...
read more",2019-01-25,6
Honeywell International Inc.,HON,Band 4 MIP bonus delayed due to attrition???,"One of my director friends in an SBG role in USA said HR informed them bonus payments may not be March 8 this year. They are considering delaying due to risk of attrition In HR Direct it says it will be paid within the first 2 and a half months of...
read more",2019-01-23,6
Honeywell International Inc.,HON,401k Match predictions,Number 1: Match will be postponed until mid year results come out. Then nothing will be said and we never get a 2018 match. Number 2: Executives will sell stock options the day after we get our match and drive the stock price down 12%,2019-01-23,13
Horace Mann Educators Corp. Insurance Company,HMN,2015 Layoffs?,"Do you know if we are going to have layoffs next year, I heard that a reorganization might be taking place in the IT group and that some folks might be downsized.",2014-12-19,0
Horizon Lines Inc.,HRZ,Do you know if Horizon Lines hire people straight from school?,Do you know if Horizon Lines hire people straight from school?,2012-12-08,0
Hormel Foods Corp.,HRL,Hormel Foods Layoffs 2019,Do you think there will be Hormel Foods Layoffs in 2019?,2018-10-30,0
Hormel Foods Corp.,HRL,A lots of politics,I left on my own. Could not handle politics in the Corp office. I hope all is fine,2017-10-15,0
Hormel Foods Corp.,HRL,Hormel Foods Layoffs 2018,I needed to vent a bit as there are many rumors about layoffs in Austin.,2017-10-15,0
Hormel Foods Corp.,HRL,Hormel Foods Layoffs 2017,Do you really think that executives are that stupid to leak info about layoffs in Austin.,2016-11-23,2
Hormel Foods Corp.,HRL,Hormel Foods Layoffs 2016,What is the likelihood of Hormel Foods layoffs in Austin in 2016? Please let me know if you have any information.,2015-11-05,0
Hormel Foods Corp.,HRL,Stockton Layoffs 2015 at HF,"We already had cuts, now let's see what the rest of the year brings. We had cuts in Early January.",2015-03-24,2
