company,ticker,title,body,date,replies
H&E Equipment Services Inc.,HEES,Give the conditions in the construction industry what's the likelihood that H&E recovers and starts to hire again?,Give the conditions in the construction industry what's the likelihood that H&E recovers and starts to hire again?,2010-06-30,0
H&R Block,HRB,"Hiring, firing…",H&R Blocks hires seasonally,2018-10-30,0
H&R Block,HRB,H&R Block Layoffs 2019,Make a prediction and tell us what you think about H&R Block Layoffs in 2019 -- Thoughts??,2018-10-30,0
H&R Block,HRB,Major closing announced at H&R Block,"H&R Block is closing 400 of its smaller offices. The company claims that no jobs will be cut as part of the closings, but I'm pretty sure nobody is buying that. Even if everybody is given a job at other H&R Block locations nearby (as they claim the...
read more",2018-06-14,1
H&R Block,HRB,Layoffs at H&R Block,"They laid off 80 or so full time year round Area Managers that were a part of a company wide 3 year pilot program at the end of April and are going back to part time seasonal managers company wide. Posted in an old thread by @PL58zZd-3Ohqc but it's...
read more",2018-06-11,0
H&R Block,HRB,H&R Block Layoffs 2018,"Now, let's try to predict or forecast if we might have job cuts in Kansas City.",2017-10-15,1
H&R Block,HRB,H&R Block Layoffs 2017,"Financial Market keeps going up and down, there is a ton of uncertainty and people are talking about layoffs in Kansas City.",2016-11-23,1
H&R Block,HRB,H&R Block Layoffs AGAIN in 2016,"Layoffs started Monday, April 25th and continued through today. Hundreds of full time staff being laid off.",2016-04-26,2
H&R Block,HRB,Kansas City headquarters layoffs 2016,"Any updates here? I was part of the group that was cut in 2015, I heard that more folks might be leaving. I hope that the cuts are not deep and wide - all the best to all.",2016-04-26,1
H&R Block,HRB,All hands meeting last month lead by Bill Cobb cut backs were announced,"In fairness look at the Net Worth of the Leadership Team and compensation plans down to the ""pay check to pay check"" team. Suggest areas for improvement for a good story.",2016-04-07,1
H&R Block,HRB,H&R Block Layoffs 2016,What is the likelihood of H&R Block layoffs in Kansas City in 2016? Please let me know if you have any information.,2015-11-05,1
H&R Block,HRB,Do you always let people go after April 15?,Just asking,2014-03-10,0
H&R Block,HRB,"Kansas City layoffs? Anyone? I hear a ton of rumors, maybe 2014?","Kansas City layoffs? Anyone? I hear a ton of rumors, maybe 2014?",2013-11-06,0
H.B. Fuller Co.,FUL,I am a business manager are you hiring?,no body text,2013-12-12,0
H.J. Heinz Co.,HNZ,Significant synergy opportunities,"As we merge: ""Significant synergy opportunities"" are touted as one of the benefits of the merger. We should interpret this as ""MASSIVE LAYOFFS COMING""",2015-03-26,1
H.J. Heinz Co.,HNZ,2015 RIFs at Heinz and Kraft,Do you think we will be having layoffs in 2015 due to the merger with Kraft? How is this going to impact us? Do you think IT will be affected a lot?,2015-03-26,1
H.J. Heinz Co.,HNZ,Buffet makes everyone happy,"unless you work for him, in that case, you hate the sage... no layoffs right now",2014-08-29,1
H.J. Heinz Co.,HNZ,Pocatello plant,"Heinz will be closing Pocatello plant, over 400 people will be let go. This will impact everyone, the city might have to layoff of city workers.",2013-12-18,0
H.J. Heinz Co.,HNZ,Warren Buffet will take over Heinz,Warren Buffet will take over Heinz. Hope that means many will keep their jobs and not lose them.,2013-03-12,0
H.J. Heinz Co.,HNZ,Love their catchup? Bloody red...,Love their catchup? Bloody red...,2010-06-30,0
HCA Holdings Inc.,HCA,HCA Layoffs 2019,This is a master thread about HCA Layoffs in 2019?,2018-10-30,1
HCA Holdings Inc.,HCA,They are still lating people off in Irving and FL but this time no severance.,no body text,2018-07-17,1
HCA Holdings Inc.,HCA,No notice ahead of layoffs,"My friend worked in the Irving office. They were given three months severance pay and got to keep their benefits for the time. There was NO notice given that they were getting laid off. Literally they went into the conference room and without getting...
read more",2018-04-07,1
HCA Holdings Inc.,HCA,HCA layoffs this week,Layoffs in North Texas division Anybody here has more info on this and layoffs at HCA this week in general? Did anything else get hit?,2018-03-30,3
HCA Holdings Inc.,HCA,HCA Layoffs 2018,It's hard to see things getting better - are we going to have job reductions in corporate in Nashville.,2017-10-15,7
HCA Holdings Inc.,HCA,Contractors,"So the rumor mill for HCA is that contractors will be forced to move over as employees, or be let go. The decision to offer or let go is being made by upper management. So this might mean a large pay cut for many. Good thing is they are offering up...
read more",2017-02-03,1
HCA Holdings Inc.,HCA,FLSA Changes...,"So HCA went ahead with the FLSA changes, even though it got blocked. Hear there are a ton of people, mainly in administration, that are not happy. Moving from exempt to non-exempt, could upset those that don't really work all the hours they are...
read more",2016-11-29,0
HCA Holdings Inc.,HCA,HCA Layoffs 2017,How about a bit growth for a change - I do hear that we may have layoffs in Nashville.,2016-11-22,1
HCA Holdings Inc.,HCA,Layoffs in the North Texas Division,Was laid off today with about 15 minute's notice. Very sad to leave a great position and a great team.,2016-05-28,1
HCA Holdings Inc.,HCA,"Hca has begun layoff as of yesterday may 26,2016 in the north Texas division!",no body text,2016-05-27,1
HCA Holdings Inc.,HCA,HCA Layoffs 2016,What is the likelihood of HCA layoffs in Nashville in 2016? Please let me know if you have any information.,2015-11-05,0
HCL Technologies,HCLTECH,Is it ok to join hcl,"Hi, i just got an offer from hcl technologies as consultant in security domain at chennai. Pls let me know is it ok to join hcl or dxc.",2017-08-31,2
HCL Technologies,HCLTECH,layoff of non tamil employees in full swing,layoff of non tamil employees in full swing.,2017-04-11,1
HD Supply,HDS,HD Supply Layoffs 2019,Is there going to be any reorg or HD Supply Layoffs in 2019?,2018-10-30,0
HD Supply,HDS,HDS Cannot continue like this,"Folks running the ship at HDS need to be careful as the GE model is not the answer for the current problems - they need to think about their team members and stop just trying to save their own jobs and survive - they need to take care of the team -...
read more",2018-09-01,0
HD Supply,HDS,Rumors that the Hd supply Santee office closing,There are rumors circulating that the Santee office is going to close down . Is there any truth to the rumors ?,2018-05-24,2
HD Supply,HDS,HD Supply Layoffs 2018,I spent last 5years with our company and it'd be a real shame if they were to decide to lay people off from our offices in Atlanta.,2017-10-15,0
HD Supply,HDS,Atlanta Safe But HD Supply San Diego Layoffs Eminent,"HD Supply has made it clear that they are set to stReamline Operations and Bolster their efforts in the Atlanta market, so I am guessing that means HD Supply Atlanta based workforce shouldn't be seeing too much by way of layoffs. However HD Supply...
read more",2016-04-10,0
HHGregg Inc.,HGG,Things continue to slide - hhgregg will need a major turnaround,"It seems to me like nobody at hhgregg cares any more - things are not going well yet people are lethargic and they lack initiatives. Listen, I know that any initiative will be hard to push thru as managers always stonewall you with process, legal...
read more",2017-08-25,1
HHGregg Inc.,HGG,HHGREGG Layoffs QUESTION - What will happen with vacation time and benefits?,Do you know what will happen?,2017-04-07,1
HHGregg Inc.,HGG,Going out of business,Liquidation sales begin tomorrow for remaining stores,2017-04-07,2
HHGregg Inc.,HGG,Hhgregg lays off Sales Managers in sub $10m stores on February 2nd 2017. Stock prices respond with even bigger losses. Once $30 now half a dolla,no body text,2017-02-04,0
HHGregg Inc.,HGG,Massive job losses at hhgregg corporate office,hhgregg is bleeding money from disappointing sales. The retailer laid off 47 people from their corporate office on February 2nd 2017. More job losses to come as the retailer struggles to find it's footing in a hyper competitive market.,2017-02-03,0
HKN Inc.,HKN,Harken Energy Corporation is still doing well,"Texas and Gulf Region might have issues in 2015 because of oil prices dropping, but we will see what happens as you never know in what direction prices might go.",2015-01-11,2
HNI Corp. (HON Furniture),HNI,Leadership,"HNI leadership has been and continues to be a traditionally insulated group of Midwest males who believe who profess to be believers in the member culture but are nothing like the original founders. When Stan Askren took over it became a culture of...
read more",2019-03-06,0
HNI Corp. (HON Furniture),HNI,HNI Layoffs 2019,Do you predict that there will be HNI Layoffs in 2019?,2018-10-30,1
HNI Corp. (HON Furniture),HNI,"No updates, huh...","nothing so far. TF is laying off today, hopefully HON will be good.",2018-10-25,0
HNI Corp. (HON Furniture),HNI,HNI Layoffs 2018,Layoffs always happen - don’t freak out - be coooool… you cannot change that fact. Accept it and focus on work. We are not safe here in Muscatine Iowa.,2017-10-15,0
HNI Corp. (HON Furniture),HNI,HNI Layoffs 2017,If I tell you what - I am concerned you'll laugh - but how can you ignore so many warning signs here in Muscatine Iowa.,2016-11-23,0
HNI Corp. (HON Furniture),HNI,Artcobell Corp,"I guess HNI finally gave up. You bought Artcobell Corp in 2011. You didn't know a thing about the K-12 furniture industry and five years later you still could not figure it out. Teresa and Eric came in and could not make it work. I guess Eric will...
read more",2016-10-02,0
HNI Corp. (HON Furniture),HNI,HNI Layoffs 2016,What is the likelihood of HNI layoffs in Muscatine in 2016? Please let me know if you have any information.,2015-11-05,1
HP (Hewlett-Packard),HPQ,Any expected layoffs due poor Q1 2019 performance?,no body text,2019-02-28,2
HP (Hewlett-Packard),HPQ,Laid-off by HPI in 2016. Eligibility to join HPI back,I was paid 9 weeks of severance in 2016 by HP Inc. It was mentioned in the letter that I won’t be eligible to join HP Inc ever in future. Do HP Inc ex-employees still join with or without any exceptions?,2019-02-23,4
HP (Hewlett-Packard),HPQ,Layoffs in NJ/NY offices,Does anyone know of layoffs that are going to happen within the new jersey/new york area?,2019-01-29,0
HP (Hewlett-Packard),HPQ,"Forced Distribution Reviews, Still Alive and Kicking Here?","Old HP (before HP / HPE split) had ""Forced Distribution Reviews"", AKA ""kill teamwork policy"", AKA ""make your co-workers look bad, so that you can look better than them"", for raises for you and layoffs for them. HPE has now done away with them, and...
read more",2019-01-19,3
HP (Hewlett-Packard),HPQ,Wave of the future ... Happy New Year - 2019,"Change for the good or change for the better? This is a very interesting and long but VERY informational vid. For 3D or Conture Crafting., about 1:57:00., is see HP performing a major shift as other hi-tech companies. Happy New Year H-P. Zeitgeist...
read more",2019-01-04,1
HP (Hewlett-Packard),HPQ,Is this some kind of a joke?,"How are we among the top one hundred companies to work for according to Glassdoor? Maybe years ago, but today? HPI is not the company it once was and it certainly is not one of the best places to work for...
read more",2018-12-06,7
HP (Hewlett-Packard),HPQ,HP Layoffs 2019,"If the economy turns around, do you anticipate any HP Layoffs in 2019?",2018-10-30,6
HP (Hewlett-Packard),HPQ,Is HPI bringing jobs back to the US anytime soon,"In the AP news other tech companies are building new factories and therefore hiring US labor. I haven’t heard a peep about HP doing the same. With trade and technology theft, other companies have figured out that it’s best to return to On-shore...
read more",2018-10-28,3
HP (Hewlett-Packard),HPQ,Australia Wave 3 Layoffs about to kick in.,"Around 9 September 2018 , Hp Inc will kickoff the 3rd round of the Australian WFR(work force reduction) .",2018-08-30,0
HP (Hewlett-Packard),HPQ,What is the typical end of year bonus?,I’m new at HP and I would like to know what is the typical end of year performance review bonus? And what is the typical salary increase after each year? I’m an engineer located in the United States Thanks!,2018-08-10,4
HP (Hewlett-Packard),HPQ,Budget constraints?,"I am just one of many thousands of temp employees that work at HP. My employer sent out an alarming email stating that due to HP budget constraints, both contract workers and HP employees will not be working the entire 4th of July week. Only certain...
read more",2018-06-21,11
HP (Hewlett-Packard),HPQ,"This is an upgrade, not a new thing","HP didn't just announce 5,000 new layoffs. This is a part of the 4,000 layoffs that were originally announced two years ago. The company increased its original estimate of 4,000 by 500 to 1,000. In addition, some of these layoffs have already taken...
read more",2018-06-06,9
HP (Hewlett-Packard),HPQ,"HP is planning 5,000 job cuts as part of restructuring plan in 2018-2019","A 5,000 layoffs is coming. Does anyone know in which area it will come? Personal systems? Industrial Printing? Office Printing? 3D Printing? or in which site? or when exactly?...
read more",2018-06-06,4
HP (Hewlett-Packard),HPQ,IT restructuring at HP,"Looks like a lot of restructuring about to happen in IT....you know what that means... I have come to hate the word restructuring. It is nothing than a sneaky way to announce layoffs without actually using the word layoffs. I guess they think it's...
read more",2018-06-01,8
HP (Hewlett-Packard),HPQ,Jobs going to India,"A lot of work from Vancouver and Boise is being moved to India, affecting contractors. Not sure about HP positions, but I would suspect some are being off-shored as well...
read more",2018-05-25,8
HP (Hewlett-Packard),HPQ,Layoffs after all hands meeting,Watch for layoffs 3/2/18,2018-02-16,24
HP (Hewlett-Packard),HPQ,Oh dear ....,https://www.theregister.co.uk/2017/12/11/hp_synaptics_keylogger/,2017-12-13,1
HP (Hewlett-Packard),HPQ,"Come back home, my beloved daughters and sons...","... Things will be so different this time, so come back to papa. Much lower salaries, less benefits, at least 70% of the population 25 years old or younger... You know this is what you want. Come on... Give me a hug! DXC Technology will be hiring...
read more",2017-11-14,12
HP (Hewlett-Packard),HPQ,HP Layoffs 2018,Is it true that we might have cuts (layoffs) in Palo Alto.,2017-10-15,9
HP (Hewlett-Packard),HPQ,"HP is selling many patents, changes are coming","HP is biding over 1,000 patents in printing and computing areas. http://oceantomobidask.com/",2017-09-24,4
HP (Hewlett-Packard),HPQ,At least your company is out there about it unlike others in SV,http://www.reuters.com/article/us-hpe-redundancies/hpe-plans-5000-job-cuts-bloomberg-idUSKCN1BW34C?il=0,2017-09-21,0
HP (Hewlett-Packard),HPQ,HPE Malayasia Going to cut lot of jobs,"Yesterday they announce they are going to cut lot jobs in hpe malaysia by end of this month, most relating to DXC....",2017-08-17,2
HP (Hewlett-Packard),HPQ,Both HP Inc and HPE slapped with class-action suit,"Posted this in HPE, but it should be seen here as well. A class-action suit has been submitted against both HP inc. and HPE. The suit both alleges racism and ageism. Gotta say, with latest happenings, not surprised in the least...
read more",2017-07-26,8
HP (Hewlett-Packard),HPQ,Layoffs in San Diego,no body text,2017-04-20,3
HP (Hewlett-Packard),HPQ,HP Boise-Idaho site may be closing other sites?,http://fortune.com/2017/03/16/idaho-hp-campus-building/,2017-03-26,2
HP (Hewlett-Packard),HPQ,Thieves,"BRIEF-HP says CEO Weisler's 2016 compensation was $28.7 mln versus $18.7 mln in 2015 REUTERS 02/17/2017 5:30 PM *HP Inc. CFO Catherine Lesjak 2016 Compensation Valued at $12.7M, Up From $7.3M in 2015 >HPQ DJ REALTIME NEWS 02/17/2017 5:20 PM *HP CEO...
read more",2017-02-19,5
HP (Hewlett-Packard),HPQ,Does any know if other HP inc sites are closing? Ireland site was announced in the news yesterday,Ireland's HP Inc (HPI) site is closing. They are laying off 500 at least. Does anyone knows if other sites may close? How do you recognize that a site is about to close?,2017-02-10,1
HP (Hewlett-Packard),HPQ,Layoff Payoffs,http://www.forbes.com/sites/panosmourdoukoutas/2016/12/27/hewlett-packards-split-have-massive-layoffs-paid-off/#539e74055729,2017-01-01,3
HP (Hewlett-Packard),HPQ,HP Layoffs 2017,I can tell you that rumors are flying around about job cuts in Palo Alto.,2016-11-22,18
HP (Hewlett-Packard),HPQ,Massive Layoffs through 2020 - What are your thoughts?,"I was hoping things will improve here at HP but we seem to be sinking deeper and deeper ever since the split (even before the split)... What are your thoughts on the job cutting plans? HP plans to lay off 3,000 to 4,000 employees over the next three...
read more",2016-10-18,21
HP (Hewlett-Packard),HPQ,http://www.bbc.com/news/business-37651831,"US computer company HP Inc has said it expects to cut 3,000 to 4,000 jobs over the next three years. The hardware business of the former Hewlett-Packard announced the plans as part of a larger restructuring effort. It is hoped the cuts will generate...
read more",2016-10-14,2
HP (Hewlett-Packard),HPQ,Mentoring,"It is all about having a senior person as a mentor. I have seen very competent people, go nowhere, while absolute incompetents seemingly get promoted and raises. The company is built on a business plan that stresses month to month financials. They...
read more",2016-10-05,5
HP (Hewlett-Packard),HPQ,"At HP R&D Brazil, they announced that they are going to cut 55 employees (from a total of 300 or so) by the end of October FY16.","That is, by the end of this year. (This is Rio Grande do Sul, Porto Alegre -- not São Paulo.) I won't be surprise if they close the entire R&D in Brazil. It s---s anyway. Thinking they can be in this layoff list, employees are unable to focus on...
read more",2016-10-03,6
HP (Hewlett-Packard),HPQ,Ex Cisco Employee looking for HPE professional services feedback,I got laid off recently from Cisco and pretty close to land a job with HPE professional services. I would appreciate any gotchas about HPE professional services.,2016-09-25,8
HP (Hewlett-Packard),HPQ,"The ""new"" HP Inc. We all should be very proud of our strategies for gaining market share...","Way to go, Dion! You are a good disciple of Whitman... http://www.bleepingcomputer.com/news/hardware/hp-accused-of-sabotaging-non-hp-ink-cartridges/",2016-09-20,0
HP (Hewlett-Packard),HPQ,What's next? Floppy discs and cassette tapes? That's what I would call innovation...,"Competitors (specially start ups) will kick our butt on gaming & ""blended"" reality. I can easily see HP making acquisitions there very soon - bidding against heavyweights. In terms of 3D printing, I think we'll kick @ss in a big way (at least in the...
read more",2016-09-13,2
HP (Hewlett-Packard),HPQ,HP Inc. Goes Old School With Plans to Sell Copy Machines,http://fortune.com/2016/09/12/hp-printer-copier/ - Good luck with that. Xerox is extremely well positioned there...,2016-09-12,1
HP (Hewlett-Packard),HPQ,HP Agrees to Acquire Samsung Printer Business for $1.05 Billion,"Eliminating Samsung as a competitor in the printing business for $1B was a steal. I wouldn't be surprised if in 1-2 years Canon, Epson & Xerox join their printing businesses into a new stand-alone Company. In terms of HP, it's not difficult to...
read more",2016-09-12,2
HP (Hewlett-Packard),HPQ,cclass action lawsuit - hp age discrimination,I see that some employees are filing a class action lawsuit against HP. I was laid off after 31 years with HP/EDS. I suspect it was age related. I just found this website and submitted my information. http://hpagediscriminationinvestigation.com/,2016-08-26,4
HP (Hewlett-Packard),HPQ,"At least 700 more employees in HP Inc. will be cut in Q4 (Aug-Oct 2016) in order to meet the FY16 3K target (2,300 have been ""let go"" as of Q3).",Most of those remaining layoffs will be done in the US... The Q3 Company performance results weren't as bad as I expected. The issue continues to be lack of innovation to sustain/grow REAL revenues past 2017...,2016-08-25,5
HSBC,HSBC,HSBC Layoffs 2019,HSBC Layoffs 2019 What's your prediction as it relates to the possibility of HSBC Layoffs in 2019?,2018-10-30,0
HSBC,HSBC,Sink or swim,"This is not a bad company to work for, but neither is it one of the best. HSBC does provide adequate training in all aspects of the industry - just not for the position you are hired for. You are pretty much left on your own to be self taught or hope...
read more",2018-01-23,1
HSBC,HSBC,Stay away,"HSBC can be a great beginning to kickstart your career but give it a year or two at the most - and move on! This company has proven time and again that career development and growth do not exist here. I have witnessed management give promotions to...
read more",2018-01-13,0
HSBC,HSBC,"HSBC Mortgage Layoffs - 197 positions in Brandon, Florida","More mortgage industry layoffs, things are accelerating and it's not looking good for 2018.... See below: A review of state employment data indicates that several real estate finance firms have recently made, or are planning to conduct, rounds of...
read more",2017-08-09,0
HSBC,HSBC,Anybody else thinks majority of these are long obsolete?,"I ran into this article listing 16 reasons HSBC is the best place to work, and while I can't find the date it was posted, it feels utterly outdated. Most of them used to be true once upon a time, but lately, majority are a thing of the past...
read more",2017-07-18,0
HSBC,HSBC,"If HSBC can get cheaper peons, they will","There's nothing we can do to change this. There will always be people in other countries who are willing to work for much less, and HSBC will turn to them when they want to cut costs. No matter how bad they can be and how good we are - it's not...
read more",2017-07-17,1
HSBC,HSBC,"We need more, not fewer workers","I don’t understand why HSBC keeps laying off people, when we have more work than we can handle as it is. There is absolutely no life/work balance, we are expected to work unreasonably long hours to make sure everything gets done. And as people get...
read more",2017-07-14,1
HSBC,HSBC,Shares soar high,"The share prices of HSBC have never been this high, thanks to Hong Kong traders. Not sure how this will translate to future layoffs (it can cut both ways,) but it certainly bodes well for the company itself...
read more",2017-07-14,1
HSBC,HSBC,Layoffs constantly loom over us,"I am really sorry for the folks in Brandon who are losing their jobs, but this is nothing new at HSBC. They only make the news when they do a clustered round of layoffs, but they have been letting go of people constantly in the past few years. They...
read more",2017-07-14,0
HSBC,HSBC,"Brandon, Florida Layoffs - 200 people... about 70 remaining...","This is on the mortgage side. More layoffs to come. Also, as things are moving on the net, more people do internet banking and less offices and branches are needed. This will result in many branches to be closed, it'll be a bloodbath in years to...
read more",2017-07-13,0
HSBC,HSBC,Brandon FL,"WARN filed, 197 cut.",2017-07-06,0
HSBC,HSBC,Do not stay too long here,"HSBC is a great place to spend a few years at but it's hard to work there - the deadlines can be really tough on the IT side and there are many egos and people who are really full of sh-- - they will work you a lot and you will be stressed out but...
read more",2016-08-31,2
HSBC,HSBC,What's there not to love?,"Yearly layoffs, and always handled very poorly. Super slow moving, red tape everywhere, wait, wait, wait, layoff... Finally, no any room for advancement in middle level unless you are already a senior manager. What's there not to love?",2016-05-17,0
HSBC,HSBC,Guided Percentages,"Forced distribution (helpfully rebranded ""guided percentages"") and stack ranking is poisonous and makes it difficult to build talented teams and impossible to keep them together.",2016-05-16,1
HSBC,HSBC,Sheffield,"Dreadful low morale, period. Significant amount of ""peacocking"" by most middle/senior managers, period. No recognition or development time for technical professional development, period. Destroys WLB at most opportunities by ignoring when you're...
read more",2016-05-16,2
HSBC,HSBC,Outsourcing Games - Sheffield workers are training Indian counterparts,"HSBC workers are told to train their foreign replacements http://www.thestar.co.uk/news/axed-sheffield-hsbc-workers-told-to-train-their-foreign-replacements-1-7914218#ixzz48rBxVBXe America had its fair share of this (Disney, Edison), now, we welcome...
read more",2016-05-16,1
HSBC,HSBC,2016 Redundancies in UK,"From Fortune Magazine this week: The restructuring will eliminate one-fifth of jobs globally and around a sixth of jobs in Britain. HSBC, Europe’s largest bank, was to begin laying off 850 information technology workers in Britain on Monday, the...
read more",2016-05-16,0
HSBC,HSBC,2000 to be laid off by HSBC in Commercial Banking,"Savings target - 5 billion USD. To get there we'll have to have massive redundancies, up to 50,000 people will be laid off. What we know so far is that approximately 2000 people will be laid off in Commercial Banking, granted there is a ton of people...
read more",2015-11-24,1
HSBC,HSBC,"Things can improve in 2016, but still many predict layoffs","Most of the financal sector is under huge pressure, HSBC is not an exception. You can expect layoffs in NYC in 2016 but they may not be as big as we had them in the past",2015-11-09,0
