company,ticker,title,body,date,replies
Rite Aid Corp.,RAD,600 Rite Aid stores closing,"Posted this on Walgreens board, but I thought to share here as well, since Rite Aid will be the one that will bear the brunt of this consolidation. Rite Aid deal will apparently bring on carnage. Around 600 drugstores will be closed by Walgreens...
read more",2017-10-26,1
Rite Aid Corp.,RAD,Rite Aid Layoffs 2018,"It's hard to predict things, for now, at least - but folks are saying that there might be cuts in this year Camp Hill.",2017-10-15,2
Rite Aid Corp.,RAD,Rite Aid Layoffs 2017,"Now, let's try to predict or forecast if we might have job cuts in this year Camp Hill.",2016-11-23,2
Rite Aid Corp.,RAD,270 layoffs at headquarters,"This was written by the Chicago Tribune: ""Under Pessina, Walgreens has embarked on a plan to cut costs by $1.5 billion by the middle of 2017. Part of the cost-cutting plans include 270 layoffs at headquarters and other suburban offices.""",2016-08-25,0
Rite Aid Corp.,RAD,Rite Aid Layoffs 2016,What is the likelihood of Rite Aid layoffs in Camp Hill in 2016? Please let me know if you have any information.,2015-11-05,2
Rite Aid Corp.,RAD,Do you think that we'll have even more layoffs due to Walgreens Rite Aid Merger?,no body text,2015-10-28,3
Rite Aid Corp.,RAD,I think this company got acquired...,"Somebody bought them, maybe CVS or something like that.",2014-07-22,0
Riverbed Technology Inc.,RVBD,Juniper acquires Mist instead of Xirrus,no body text,2019-03-05,2
Riverbed Technology Inc.,RVBD,Book abt Riverbed,I’d like to write a book mixing a personal story with my work at riverbed in the background. It won’t be about the company per se.,2019-03-04,3
Riverbed Technology Inc.,RVBD,Old Goats,"It is clear to me the leadership are a bunch of old goats. They talk about technology that is over 2-4 years past its prime or after the flood of talent is taken. To boot, they misuse and completely do not understand what the differences are between...
read more",2019-02-26,33
Riverbed Technology Inc.,RVBD,The company still have 2B debt to pay off,"It needs to be valued at at least 5.5B so your common stock worth more than $0. We are now one of the top 3 OLDEST portfolios in TB's hand because of the company's way too under-performed. Majority of TB's companies are bought later but sold earlier...
read more",2019-02-20,10
Riverbed Technology Inc.,RVBD,Layoffs at Riverbed have started,"The entire Enterprise ISR Team (Remote and SF Office) were let go today as of 9:30am. Thier last day will be this Friday, 22nd. Judging by this, we are looking at really bad several weeks until all the layoffs are done. I'll be honest, I didn't...
read more",2019-02-20,27
Riverbed Technology Inc.,RVBD,Management needs to hit a number by a certain date and is willing to make us hungrier to get there,"New comp plan in sales is def there to get us to linearity faster with a 50% drop in BCR. Management needs to hit a number by a certain date and is willing to make us hungrier to get there. You combine this with the fact that they cancelled SKO in...
read more",2019-02-18,19
Riverbed Technology Inc.,RVBD,New comp plan,Thoughts? Is this a part of the strategy to get rid of people?,2019-02-12,11
Riverbed Technology Inc.,RVBD,New cuts?,"200 person RIF across the company coming in the next month. It’s being prepared right now. Sales will be hit hardest, but it’s cust across all departments.",2019-02-10,22
Riverbed Technology Inc.,RVBD,#BRINGJERRYHOME,"My dearest fellow Riverbedders- I don’t know about all of you but I feel like I have a little Winston Churchill in me tonight. I write this to you as I fight back the tears streaming down my face while wearing my cozy riverbed thermal and favorite...
read more",2019-01-30,78
Riverbed Technology Inc.,RVBD,Fate of the Sunnyvale office,https://www.mercurynews.com/2019/01/25/alibaba-arranges-big-lease-for-silicon-valley-outpost-in-sunnyvale/,2019-01-30,4
Riverbed Technology Inc.,RVBD,The new way seems to be to go for the cheapest labor,"I was with support for over 6 years and consider many of you family. Support is a pyramid with a foundation of L2 and a tip of L4/Staff Eng but this model only works if everyone is competent and pulls their share. When I left it was popular for...
read more",2019-01-23,3
Riverbed Technology Inc.,RVBD,Bye Bye P O'F,"So now that he's almost gone and we a new GM, how'd you think things are going to change? Pushed out or jumped ship? Is there anyone left upstairs? C'mon PM, we need you to mumble something here to cover the tracks.",2019-01-14,17
Riverbed Technology Inc.,RVBD,Beware The Ides Of March! (Or April actually),"Anyone else find it interesting that the annual Riverbed Sales Kick Off got moved from January until June? I’m not sure that “interesting” is the word the Sales dudes and dudettes would use.. unless it’s like the Chinese curse of “may you live in...
read more",2019-01-10,4
Riverbed Technology Inc.,RVBD,How we hire leaders,"It’s quite amazing when I see groups struggle because of how Riverbed hires. It seems that we hire “leaders” based on their past experience HOWEVER, is their success is predicated on “easy” then these leaders will end up clueless when times become...
read more",2019-01-06,3
Riverbed Technology Inc.,RVBD,Preferred Stock,Does the company buyback preferred stock after you leave the company? do they pay compound interest year over year or the original purchase price? anyone knows? preferred stock is the one with annual interest rate not the one worth 9 cents.,2018-12-22,5
Riverbed Technology Inc.,RVBD,Support reorg,"Just announced a Support reorganization that will change everything that has been setup since the beginning. Basically they will be adding to the bottom and removing from the top. This is coming from the board, demanding to cut costs and the b--ch...
read more",2018-11-13,11
Riverbed Technology Inc.,RVBD,what would you do to a company that keeps missing financial target,missing 5% again. i wonder what's the stock price now.,2018-10-26,6
Riverbed Technology Inc.,RVBD,Service delivery platform team of 50 fired across locations,"I was part of new product(Service delivery platform) that Riverbed was developing. Whole product was sc-apped one month back . 30 engineers from India and near about similar number from US and UK were fired. Horrible management. Provided only one...
read more",2018-10-10,9
Riverbed Technology Inc.,RVBD,Order Hell,Trying to get anything done with Riverbed is like pulling teeth. Orders take forever to turn around and getting anything from them is difficult. TAKE MY MONEY!!! This should not be an issue. The reps basicly have no sense of urgency,2018-09-26,2
Riverbed Technology Inc.,RVBD,Layoffs done very quietly,"Layoffs done very quietly, no internal announcement, just 1:1 calls with manager on webex with HR and no clear reason given as to why? If RVBD wants to really address the stagnant sales, upper management of Sales should be RIF'd and new blood brought...
read more",2018-09-06,0
Riverbed Technology Inc.,RVBD,I got laid off today!,"From what I can tell about 7.5% of the sales force got RIFd. 75% of those let go in sales were technical sales engineers. I am not sure about the RIF percentage in other areas of the company. Decent severance package. Looks like 1 month severence for...
read more",2018-08-30,4
Riverbed Technology Inc.,RVBD,Layoffs this week,"Some cuts planned in sales and/or sales engineering and some departures have happened in sales too. I think the company's bet on SD-WAN didn't pan out, and shifting from capex revenue to opex/SaaS revenue incoming is causing short term issues with...
read more",2018-08-30,1
Riverbed Technology Inc.,RVBD,Engineering Title,Does this company not have any title other than member of technical staff? How do i know if someone is more senior technical person without counting his grey hairs?,2018-07-27,4
Riverbed Technology Inc.,RVBD,Minor layoff for Xirrus,Minor layoff for overlapping Xirrus sales positions.,2018-07-13,7
Riverbed Technology Inc.,RVBD,You get a holiday.. you get a holiday.. we all get a holiday!,"So, enforced leave for us US staff members for July 2-6 (Independence Day) and November 19-23 (Thanksgiving).. to save millions and make EBITDA look better. Yay!",2018-05-24,5
Riverbed Technology Inc.,RVBD,Captain's leaving the sinking ship!,"Jerry has announced he's retired and the Sales VP Paul Mountford just got a promotion to CEO...
read more",2018-04-03,47
Riverbed Technology Inc.,RVBD,Watch your back,"If you are contemplating a position at Riverbed my advice would be to keep on walking. I’ve been with the company for a little over 2 years and am currently looking elsewhere. My department has coworkers that seem to be undermining each other as much...
read more",2018-01-26,5
Riverbed Technology Inc.,RVBD,No strategy,"We've been stuck in one place for nearly a decade, and we don't seem to be able to move one step forward. We have leadership that doesn't know how to grow this company, they simply let things happen without proper strategy in place. How do they think...
read more",2018-01-17,2
Riverbed Technology Inc.,RVBD,When is the next IPO coming ?,No bonuses and meagre compensation.,2017-12-19,10
Riverbed Technology Inc.,RVBD,Campus in Bangalore,So lately there's been a huge number of new employments in the Bangalore campus for the Engineering side. Looks like TAC/support centers around the world will see layoffs sooner than expected. Your thoughts?,2017-10-02,4
Riverbed Technology Inc.,RVBD,PS and Support and Sales,"Its not as bad as it was in 2015. Not as many pink slips in PS and Support apparently. More in Sales (surprise surprise), a few in engineering too",2017-05-15,0
Riverbed Technology Inc.,RVBD,Does Thoma Bravo Lay Off People?,"What's their track record as it relates to companies that Thoma Bravo acquires? Do they cut payroll swiftly? How's your experience? Disclosure: I am not with Riverbed, I am with another company that recently got acquired by Thoma Bravo and now we...
read more",2017-05-10,6
Riverbed Technology Inc.,RVBD,2017 Layoff coming in 2nd week of May,Riverbed is doing layoff either later on this week (5/8-5/12) or the beginning of next week (5/15-5/19).,2017-05-09,24
Riverbed Technology Inc.,RVBD,Heard more people have been laid off sporadically in the last few weeks. Any confirmations?,no body text,2015-07-16,2
Riverbed Technology Inc.,RVBD,Riverbed Class Action Suit,Just received a Riverbed Class Action Suit here - anyone else got the same outside of US? Does it mean Jerry & Co. gets sued and we get some money? I did quite read and/or follow the several pages of legal stuff.,2015-06-23,3
Riverbed Technology Inc.,RVBD,How will this layoff impact customers?,"Curious to know people's opinions (employees and non-employees) regarding if this layoff will have a major negative impact to current/new customers of Riverbed's technology (legacy opnet products included). I realize it will affect support and...
read more",2015-05-28,6
Riverbed Technology Inc.,RVBD,Riverbed might have been dyslexic when they bought OPNET for 1 billion. AppResponse was the cash cow but they choose to invest in AppInternals.,I've always wondered why the solution that produced the most revenue for OPNET kept on being minimized by Riverbed.,2015-05-22,2
Riverbed Technology Inc.,RVBD,Seems second wave is coming. Some countries are impacting.,no body text,2015-05-17,3
Riverbed Technology Inc.,RVBD,Will Thoma Bravo keep two companies separate that have competing product lines?,"Doubtful. Split and merge seems likely. Big question is where does RB Core go. Standalone, sold off, merged with other HW company they own?",2015-05-16,0
Riverbed Technology Inc.,RVBD,Riverbed and it's new owners are ruthless and totally lack any kind of human kindness.,"They have cut over 30% of their workforce to improve profits. The layoffs were based on how much you cost the company, not on performance. Then they give a measly severance that won't sustain anyone for more than two months. If I was a prospective...
read more",2015-05-16,1
Robert Half International Inc.,RHI,Temp agency,"This is a temp agency, most people work here as temps",2018-10-30,0
Robert Half International Inc.,RHI,Robert Half Layoffs 2019,Do you think there will be Robert Half Layoffs in 2019?,2018-10-30,0
Robert Half International Inc.,RHI,2018 layoffs,There were huge cuts made to Marketing in the past month with many layoffs of long-term staff. I wouldn’t expect much growth at Robert Half this year. Corporate culture there is still as backstabby as ever. Who’s next to get voted off the island?,2018-03-26,1
Robert Half International Inc.,RHI,Robert Half Layoffs 2018,How about a bit growth for a change - I do hear that we may have layoffs in Menlo Park.,2017-10-15,0
Robert Half International Inc.,RHI,Robert Half Layoffs 2017,"When will things improve, I am still hearing about layoffs in Menlo Park.",2016-11-22,0
Robert Half International Inc.,RHI,"The company is rotten inside, not sure about layoffs, but it'll collapse if culture of backstabbing is not changed",no body text,2016-06-09,2
Robert Half International Inc.,RHI,Robert Half Layoffs 2016,What is the likelihood of Robert Half layoffs in Menlo Park in 2016? Please let me know if you have any information.,2015-11-05,1
Robert Half International Inc.,RHI,Robert Half Layoffs in Corporate Office,"Is there any truth in this, I hear rumors that the corporate office might be consolidating and that some jobs in finance, marketing and HR might be gone. Robert Half has had layoffs before and nothing should surprise us, even though I think that...
read more",2015-09-29,0
Roche,RHHBY,Roche Diabetes Care Layoffs soon,I'm in Indy and I heard this from colleague in Mannheim: Layoffs planned for around April 2019. 1000+ to be affected. Package will be offered for those not quite retirement age yet. What have you heard?,2019-02-18,0
Roche,RHHBY,Layoffs in Santaclara,"Heard from a friend, a whole department has been laid off. Some of them were hired very recently a year or less. The future is bleak for this division in core research. Yet they continue to lure experienced people to hire and fire later. Stay away...
read more",2018-08-05,0
Roche,RHHBY,Hope the company disintegrates and dies soon.,"With the kind of fools that run the division and work for the division in Pleasanton, CA -- both Roche Molecular Systems and Roche Sequencing, can't wait for this filthy company to have massive layoffs and completely die-out. These people are too...
read more",2018-05-26,0
Roche,RHHBY,Roche Diabetes Care - Indianapolis Layoffs @ Roche (March 2017),FTE layoffs - about 133 - we will also can 24 contractors.,2017-03-15,0
Roche,RHHBY,Roche Carolina Layoffs in 2016 possible?,Do you know if clinical supplies coming out of RCI have been held up? Is this a contamination issue? Some trials are definitely going to be delayed if this is true - how about layoffs in 2016?,2016-01-04,0
Roche,RHHBY,Roche Severance Payment,Is it true that Roche may be decrease the overall compensation offered via severance payments for the upcoming layoffs. Please let me know if you know anything.,2015-11-12,1
Roche,RHHBY,Roche layoffs 2015,"2015 layoffs will be massive, a few patents are expiring and Roche's salesforce is bloated. You'll see probably around 500 jobs cut in 2015 across Roche.",2014-10-31,1
Roche,RHHBY,2013 Layoffs at Roche,"Roche's 454 Life Sciences subsidiary axed around 100 jobs in Penzberg, Germany and 60 here in the states (Branford, CT) - this happened almost a year ago (I think in April 2013) - I used to work at this location (Branford) - I'd say almost 50% of all...
read more",2014-05-08,0
Rock-Tenn Co.,RKT,Rock-Tenn Layoffs 2019,"If the economy turns around, do you anticipate any Rock-Tenn Layoffs in 2019?",2018-10-30,0
Rock-Tenn Co.,RKT,Rock-Tenn Layoffs 2018,I need to know when layoffs will happen (need to make a major purchase and I am anxious) here in Norcross.,2017-10-15,0
Rock-Tenn Co.,RKT,Rock-Tenn Layoffs 2017,Has the layoff been announced lately are there rumors is there any updates on what's going on - I am referring to layoffs in Norcross.,2016-11-23,0
Rock-Tenn Co.,RKT,Rock-Tenn Layoffs 2016,What is the likelihood of Rock-Tenn layoffs in Norcross in 2016? Please let me know if you have any information.,2015-11-05,0
Rock-Tenn Co.,RKT,2014 Cuts,Anybody has info on reorg?,2014-08-15,0
Rock-Tenn Co.,RKT,up to 36 layoffs in the next month. 12 already gone re-evaluating further action in the coming weeks,no body text,2014-08-04,0
Rock-Tenn Co.,RKT,Back in May 2013: RockTenn Co,"Back in May 2013: RockTenn Co. will close its Milwaukee container facility in July 2013, leaving almost 70 people without jobs, according to a RT's letter to the state of Wisconsin...",2013-10-01,0
Rockwell Automation Inc.,ROK,Rockwell Automation Layoffs 2019,How likely is that there will be Rockwell Automation Layoffs in 2019?,2018-10-30,2
Rockwell Automation Inc.,ROK,Rockwell Automation and Future of the industry,Just a generic question - what do you think will happen,2017-10-15,1
Rockwell Automation Inc.,ROK,Rockwell Automation Layoffs 2018,Just keep working and do not worry about job cuts - I think we are safe here in Milwaukee.,2017-10-15,2
Rockwell Automation Inc.,ROK,Singapore,How are things in Singapore - when I left (in 2014) all was well... Now I am hearing they do have issues...,2017-08-13,0
Rockwell Automation Inc.,ROK,Rockwell Automation Layoffs 2017,"Layoffs always happen, you cannot change that fact. Accept it and focus on work. We are not safe here in Milwaukee.",2016-11-23,0
Rockwell Automation Inc.,ROK,"2017 Layoffs Coming, Rockwell Automation - RUMORS???",Anyone has more info about the plans for massive layoffs in 2017?,2016-11-03,1
Rockwell Automation Inc.,ROK,Layoffs happened Report that 30 were payed off in sales around the country,"Here we go again, layoffs in sales, my busy that got the axe is one of the best I've ever worked with. Go cheap, go young! New motto!",2016-10-28,1
Rockwell Automation Inc.,ROK,Layoffs Coming?,Layoffs coming? Seems like something is brewing with the bad financial outlook and letting go of contractors in Mequon. http://finance.yahoo.com/news/rockwell-automation-rok-tops-q2-154703816.html,2016-04-28,0
Rockwell Automation Inc.,ROK,Rockwell Automation Layoffs 2016,What is the likelihood of Rockwell Automation layoffs in Milwaukee in 2016? Please let me know if you have any information.,2015-11-05,3
Rockwell Automation Inc.,ROK,Recent layoffs,"There have been several layoffs in the south east district sales force. Once again, senior management will sacrifice good workers to cover for their inability to run a profitable company",2015-10-30,1
Rockwell Automation Inc.,ROK,huge layoff both contract and fulltime,"They are currently doing HPC with latest architecture, probably it will complete by end 2016, so they will have huge layoff both contract and fulltime",2015-10-09,0
Rockwell Automation Inc.,ROK,Mass layoff in Rockwell Automation has happened in more frequent cycles in recent years...,"In 2009, 2012, 2013, 2015 there was a few rounds of mass layoffs in different locations of at least 70+ headcounts and some smaller low key ones (affected US, China, Singapore, Europe, etc.). It is highly probable that in 2016/17, another wave of...
read more",2015-03-20,2
Rockwell Collins,COL,Rockwell Collins Layoffs 2019,"If the economy turns around, do you anticipate any Rockwell Collins Layoffs in 2019?",2018-10-30,4
Rockwell Collins,COL,"Irvine, CA layoffs announced by Rockwell Collins","On Monday, Rockwell Collins announced to its employees at their Irvine, CA office that they will be closing that location sometime soon after the end of 2018. They have provided all employees with packets detailing the severance offers for those...
read more",2018-09-26,2
Rockwell Collins,COL,Layoffs in Houston’s office,12 people laid off this week out of the Houston office which focuses on corporate aviation.,2018-04-11,0
Rockwell Collins,COL,"Winston Salem Hit, Jobs Sent to the Philippines",I guess no more surprises for everyone... https://www.bizjournals.com/triad/news/2018/03/08/its-official-rockwell-collins-will-lay-off-119.html,2018-03-09,1
Rockwell Collins,COL,Will there be lay offs in Wilsonville Or.?,no body text,2018-03-01,3
Rockwell Collins,COL,tidlywink tester,My bro-in-law was just laid off from the SLC location. He's been with the company almost 20 years.,2018-01-19,2
Rockwell Collins,COL,Get ready for more layoffs at Rockwell Collins,"Rockwell Collins is planning to lay off 130 employees in Winston-Salem. Still not a certainty, but chances are that if they announced the possibility, it will turn into reality...
read more",2017-10-24,3
Rockwell Collins,COL,Do you think that we may be having yet another round of cuts soon?,Thoughts?,2017-10-15,0
Rockwell Collins,COL,Rockwell Collins Layoffs 2018,I need to know when layoffs will happen here in Cedar Rapids Iowa.,2017-10-15,0
Rockwell Collins,COL,Acquisition unrelated layoffs,"http://www.thegazette.com/subject/news/business/rockwell-collins-cut-124-iowa-jobs-as-part-of-announced-reductions-20170929 Josh Baynes, a Rockwell spokesman, said this week the company’s workforce reductions came to 124 for the fiscal year, which...
read more",2017-10-02,1
Rockwell Collins,COL,September layoffs at Rockwell Collins,"Several people were let go at my location yesterday. I saw somebody else mentioned they had layoffs as well, which now has me worried. Do we know if this is something on a larger scale that will continue in the following days, or just more of the...
read more",2017-09-13,2
Rockwell Collins,COL,UT's business revolves around layoffs,They mastered layoffs and we should brace for the impact. Just look at this warning (by KCRG): http://www.kcrg.com/content/news/I9-U-of-I-professor-warns-RockwellUTC-acquisition-may-cost-jobs-442810303.html,2017-09-07,3
Rockwell Collins,COL,UT's Rockwell Collins Acquisition Layoffs,"Get ready for layoffs, if the deal closes you will be hit. In a major way. Trust me, I've been thruough with my company. Most likely overlaps will be in HR, Finance, IT and Marketing - you will see some cuts there - depending on how they go about it...
read more",2017-09-06,0
Rockwell Collins,COL,Cancelled: PAVES On-demand In-Flight Entertainment products,"Rockwell Collins in Irvine, California laid off 50+ employees about a month ago. Upper management made a decision to cancel their PAVES On-demand In-Flight Entertainment products effective immediately. The news to cancel this product was not much of...
read more",2017-09-05,1
Rockwell Collins,COL,Irvine Layoffs,"Do you have more info on what happened, who was let go? There was like a zero media coverage of this and I wanted to see if someone would be able to share any info.",2017-02-24,1
Rockwell Collins,COL,Cedar Rapids / Custodian Layoffs,63 Custodians were laid off a few weeks back... Here is the TV coverage: http://www.kcrg.com/content/news/People-protest-outside-of-Rockwell-Collins-following-recent-layoffs-411386095.html,2017-02-22,0
Rockwell Collins,COL,approximately 50 lay offs in Orange County CA this week.,no body text,2017-02-22,4
Rockwell Collins,COL,Rockwell Collins Layoffs 2017,Has the layoff been announced - I am referring to layoffs in Cedar Rapids Iowa.,2016-11-23,6
Rockwell Collins,COL,Rockwell Collins Layoffs 2016,What is the likelihood of Rockwell Collins layoffs in Cedar Rapids in 2016? Please let me know if you have any information.,2015-11-05,3
Rockwell Collins,COL,"So Phil Jasper says they are on the Cusp of Growth, yet employees in Virginia are being let go as part of a reduction in force. WTF",no body text,2015-01-12,2
Rockwell Collins,COL,"CEDAR RAPIDS, Iowa Layoffs 2011","Back in 2011 Rockwell-Collins had a RIF and laid off approximately 300 employees (and some contract folks) – this was mostly caused by federal defense budget cuts which were huge at the time. Also, there were layoffs in the non-defense part of the...
read more",2014-10-17,2
Rockwell Collins,COL,Any layoffs so far this year?,no body text,2014-10-17,1
Rockwell Collins,COL,rockwell collins downsizing,any news?,2014-01-21,0
Rockwell Collins,COL,Arinc Cuts,Do you know if anybody got cut after Arinc acquisition...,2014-01-16,1
Rockwell Collins,COL,"2008, 2012 and 2014","We had major layoffs in 2008, 500 folks were let go here at Rockwell Collins - another round was in 2012 where we cut over a thousand folks. I hear that 2014 will be the worst year on the record. I wanted to see if anybody knew what's the severance...
read more",2013-12-10,0
Rockwell Collins,COL,"sequestration had an impact, RC is not immune, we know sequestration issues will resurface and current layoffs are a result of that - brace...","sequestration had an impact, RC is not immune, we know sequestration issues will resurface and current layoffs are a result of that - brace yourself, 2014 will be a rocky year",2013-11-01,0
Rockwell Collins,COL,"Rockwell Collins, plans to lay off 300 employees and eliminate other open positions as part of a general belt-tightening to manage the impact...","Rockwell Collins, plans to lay off 300 employees and eliminate other open positions as part of a general belt-tightening to manage the impact of the economic downturn.",2013-03-01,0
Rockwell Medical Technologies Inc.,RMTI,2016 Layoffs at RM,Do you think we'll have another tough year this year - things can be improved...,2016-01-30,0
Rocky Mountain Chocolate Factory Inc.,RMCF,"closing stores, frozen in 2000","closing stores, frozen in 2000. layoffs happen every other month...",2012-10-08,0
Rogers Communications Inc.,RCI,Rogers Communications Layoffs 2019,Do you predict that there will be Rogers Communications Layoffs in 2019?,2018-10-30,0
